,name,location,rating,rating_date,title,content,visit_date,url,type,ratingDate,user_link,user_name,purpose,review_date
259,Sotogrande Davao Hotel,Davao City,1.0,,"Poor Service, book somewhere else..","The location is very convenient, the rooms and food were okay but too expensive. We had dinner at the their restaurant and waited for almost 2 hours! We had 2 of our orders cancelled because we couldn't wait any longer. Breakfast was terrible! For 450 definitely not worth the price. You have to wait for the refill, we were so hungry and we have to watch out or else you have to wait longer. At 7am, they were serving the food that were leftovers from last night's function. You can tell, food was warm and not so fresh. Then around 7:30am, they started serving breakfast items but still no refill! Seriously, I think they need more cooks or kitchen staff and proper planning! Don't be fooled with the location, yes it's convenient, book somewhere else.",April 2022,/ShowUserReviews-g298459-d23518213-r835768826-Sotogrande_Davao_Hotel-Davao_City_Davao_del_Sur_Province_Mindanao.html,hotel,Apr 2022,,,,
260,Sotogrande Davao Hotel,Davao City,1.0,,Keep away from this hotel.,"The surrounding view was great around the hotel.  Upon arrival, The roof of the driveway at the lobby was too short to cover the vehicle on the driveway so expect to get wet when you get down from the vehicle to check-in when it’s raining.  Upon check-in, they told us that buffet breakfast next morning was cancelled due to not enough people checked-in the hotel. WHO DOES THAT?! Plated breakfast was so-so.  The bed was not comfortable at all.  Don’t bring too many gadgets as they only allow “2 DEVICES” per room to connect to their Wi-FI, which is again, disappointing.  Linens and curtains still have creases.  Lots of things to improve on and if not attended, This hotel is a fail.  I would definitely not recommend this hotel to anyone.",March 2022,/ShowUserReviews-g298459-d23518213-r831806540-Sotogrande_Davao_Hotel-Davao_City_Davao_del_Sur_Province_Mindanao.html,hotel,Mar 2022,,,,
261,Sotogrande Davao Hotel,Davao City,1.0,,Defective room lock. Room Leaking. Breakfast buffet but no food available by 7:30am,"We arrived at the room and tried to lock the door but we cannot lock it. We called the front desk and someone from them went to the room, checked the door and told us that its okay we cannot lock the room as long as we have the key no one can enter our room except for us and they have many cctv (we could rely on their cctv if incase someone will trespass our room). We decided to trust then and let this problem go. Then on the evening Our room leaked and the water came from the CR of the floor above us. The staff told us it came from the CR from 8th floor we were staying at 7th floor. Our clothes were soaked in that dirty water. The front desk told me to smell the clothes and if doesn’t smell bad I should just let it dry and use it tomorrow. She was pushing me to smell the",March 2022,/ShowUserReviews-g298459-d23518213-r831006752-Sotogrande_Davao_Hotel-Davao_City_Davao_del_Sur_Province_Mindanao.html,hotel,Mar 2022,,,,
262,Sotogrande Davao Hotel,Davao City,1.0,,Overall Bad Experience,"Cannot bring own food inside the hotel, and hotel food is terrible. They only have 1 printed menu for the resto. Lousy front office staff. Parking is far from hotel entrance. If it rains, well, you just have to run. Guards are not welcoming. Feels like they are guarding central bank instead of a hotel. Only the building is  nice here.",November 2021,/ShowUserReviews-g298459-d23518213-r822529357-Sotogrande_Davao_Hotel-Davao_City_Davao_del_Sur_Province_Mindanao.html,hotel,Dec 2021,,,,
263,Sotogrande Davao Hotel,Davao City,1.0,,Worst Hotel,"Trash policies about bringing of food inside the premise of the hotel. Poor customer service. Parking area is too far from the lobby, not recommended for any purpose of stay and price is unbelievable for a hotel.",December 2021,/ShowUserReviews-g298459-d23518213-r821962854-Sotogrande_Davao_Hotel-Davao_City_Davao_del_Sur_Province_Mindanao.html,hotel,Dec 2021,,,,
264,Orchard Hotel,Davao City,1.0,,Not worth the trouble,"Orchard Hotel Davao looks like a good option….. on paper. We stayed 3 days and from they 1 they were already making excuses. they said they couldn’t follow our bookin because they are fully booked. Next day we requested that they follow our booking of having 2 rooms in close proximity, again same excuse even if there were a lot of vacant rooms being cleaned. Day 3 , aircon goes out at 2 am. We get more excuses room next to us and below  have perfectly working units as can be heard through the window. We asked for a fan because we saw them carrying a fan to another customers room, more excuses. Their suggestion open the window, that would have been ok, if the aircon units of other rooms were not blowing hot air where the window is located. This hotel has been a nightmare from the",June 2022,/ShowUserReviews-g298459-d4323014-r843427322-Orchard_Hotel-Davao_City_Davao_del_Sur_Province_Mindanao.html,hotel,Jun 2022,,,,
265,Orchard Hotel,Davao City,3.0,,Perfect location to everything.,"One important aspect of me finding a hotel is the location and Orchard hotel is the perfect spot. Near to everything. However...  I initially book my stay there through online but when i get to the hotel, the concierge in-charge did not find it. He took almost an hour calling everybody asking what to do. At last, he just asked me to sign some forms and done checking-in. Arrived at the hotel about 9pm with very tired body from travelling, I find the room just as a regular hotel room.  My assigned room was near the road. I can hear all noise. I don't mind because my house is like that. Since it is near, there is a some kind of porch for me to feel the cold breeze. Breakfast was not included. But i would rather eat at nearby restos. Toiletries was ok. Wifi - I did not use it or if",January 2019,/ShowUserReviews-g298459-d4323014-r651945145-Orchard_Hotel-Davao_City_Davao_del_Sur_Province_Mindanao.html,hotel,Feb 2019,,,,
266,Orchard Hotel,Davao City,3.0,,Rooms for Improvement,"Had an overnight stay in a single standard room that cost Php 800 per night. Good location as it is close to the mall.  Front desk is okay, approachable but can improve by having a more friendly vibe. Had reservations a day before check in. Got in the hotel around noon though we had to wait until 3pm to avail the promo of 800/night. Waited in the lobby until time of check in. Wifi is ONLY available in the lobby and you have to ask for the password.  There's no elevator, no wifi in rooms, no tv cable.  The room is reasonable for what we paid. Though I have some complaints on the bed sheets because they are a bit itchy. My guess is the sheets are not change regularly. The tabo (dipper) in the bathroom is cracked at the bottom and there's no floor rug provided. They don't allow",April 2018,/ShowUserReviews-g298459-d4323014-r573730397-Orchard_Hotel-Davao_City_Davao_del_Sur_Province_Mindanao.html,hotel,Apr 2018,,,,
267,Orchard Hotel,Davao City,3.0,,Quick stay,"We chanced upon this hotel as a last minute option and booked on the evening we used it. They reduce their rates for check-ins after 3pm.  The place was clean, staff pleasant and room facilities basic. It's good enough for a quick stay if you only need a place to sleep. Water pressure was good and had ample parking. Location is good. ",February 2018,/ShowUserReviews-g298459-d4323014-r562603489-Orchard_Hotel-Davao_City_Davao_del_Sur_Province_Mindanao.html,hotel,Feb 2018,,,,
268,Orchard Hotel,Davao City,1.0,,Unsanitary! They don't change pillows and sheets.,"The first room we were assigned to had pillows that smelled of dried sweat- clearly they don't wash their pillows! They transferred us to another room that had hairs on the bed sheets!!! Disgusting! So we asked if they could please change everything with fresh linen. They said we had to wait for the laundry to be delivered - this was 7:30 PM. The staff weren't apologetic at all; they even said ""there were only a few hairs on the sheets"" as if that would make it less awful. They had to charge us for cancelling our booking but I would rather lose money than sleep on a filthy bed. Being affordable (1,300 PHP per night) does not give you an excuse to not provide your customers clean linens. Horrible! Would not recommend this hotel to anyone.",December 2017,/ShowUserReviews-g298459-d4323014-r546140424-Orchard_Hotel-Davao_City_Davao_del_Sur_Province_Mindanao.html,hotel,Dec 2017,,,,
269,Orchard Hotel,Davao City,1.0,,service is nonexistent,"Service is nonexistent. terrible customer service and lazy staff esp their ""concierge"" with no sense of responsibility kind of approach to the guests. no good cable service, no wifi available in rooms. a hefty price tag with no service at all is a big no to recommend. ",October 2017,/ShowUserReviews-g298459-d4323014-r530128945-Orchard_Hotel-Davao_City_Davao_del_Sur_Province_Mindanao.html,hotel,Oct 2017,,,,
270,Orchard Hotel,Davao City,4.0,,Beware of this hotel! Scam! Dont sign waiver,"First i just want to share my experience in this hotel and inform others about their non smoking policy. Upon checking in you will be require to sign their waiver that they have a penalty for smoking in the building etc. Im very aware of that since davao is very strict about that policy. So when the time im about to check out, i went to the lobby and said that they will check the room first. I was surprised when they informed me that the room smells cigarette smoke and i have to pay 2,000pesos. They accused me of smoking inside the room with out any proof and their basis was by the smell of room. Take note im very considerate not to complain even their room smells terrible because my purpose was to sleep over night only (less than 8hours) i have to ask them to change the",July 2017,/ShowUserReviews-g298459-d4323014-r503786436-Orchard_Hotel-Davao_City_Davao_del_Sur_Province_Mindanao.html,hotel,Jul 2017,,,,
271,Orchard Hotel,Davao City,3.0,,"No frills, basic, but truly accessible","Stayed for a night for our business meeting the next morning. This is a basic hotel which is affordable, considering that we were in Davao City. It's a walking distance to SM Lanang Premiere, and if you just wanna go ahead on your feet other malls are just around the area. This hotel gives guests a great access to public transportation. I just would want to suggest total replacement of their pillows and linen, it's a bit overused. Overall, it's clean and you get what you pay for. Stairs all around, no elevators. They have parking spaces just at the back, with security. But one more thing, front desk peeps should try to give a better reception for guests. ",March 2017,/ShowUserReviews-g298459-d4323014-r473743130-Orchard_Hotel-Davao_City_Davao_del_Sur_Province_Mindanao.html,hotel,Apr 2017,,,,
272,Orchard Hotel,Davao City,3.0,,"Value for Money, but no cable TV","Good: Clean. Value for Money. Near SM Lanang. Spacious Parking Bad. No Wifi inside the room & no Cable Provider  If there is a WIFI Signal inside the room and have cable provider, this hotel is highly recommended",March 2017,/ShowUserReviews-g298459-d4323014-r467979595-Orchard_Hotel-Davao_City_Davao_del_Sur_Province_Mindanao.html,hotel,Mar 2017,,,,
273,Orchard Hotel,Davao City,5.0,,"Good for groups, business and leisure","This hotel is very good. It's perfect for any type of trip leisure, business or family. Rooms are very clean and complete with amenities. Rates are also very reasonable considering the good facility. We would definitely always choose this hotel for all our business and family trips.   Plus: the carinderia at the back of the hotel is a good alternative for the non complimentary breakfast. Cheap and offers local davao dishes like sinuglao and kilawin.",July 2016,/ShowUserReviews-g298459-d4323014-r437287991-Orchard_Hotel-Davao_City_Davao_del_Sur_Province_Mindanao.html,hotel,Nov 2016,,,,
0,Philippine Eagle Center,Davao City,5.0,,Must do in Davao,"We recently went to Davao and decided to visit the eagle center. We met two awesome tour guides, Luigi and Darwin ( interns) who are both knowledgeable and funny. Although Luigi was more talkative than Darwin. Even if the tour was only less than an hour it fells like I learned a ton about the eagles and other animals at the center. It’s worth every penny. I will definitely do this again when we’re back in Davao.",May 2023,/ShowUserReviews-g298459-d320865-r890382812-Philippine_Eagle_Center-Davao_City_Davao_del_Sur_Province_Mindanao.html,tourist_sites,,/Profile/ciennalexa,ciennalexa,Family,",14 May 2023"
1,Philippine Eagle Center,Davao City,5.0,,A close encounter with the Philippine Eagles,I highly recommend that you visit this place in the morning of your trip to Davao. This place closes at 4 pm in the afternoon. The visit is educational. ,Apr 2023,/ShowUserReviews-g298459-d320865-r886858760-Philippine_Eagle_Center-Davao_City_Davao_del_Sur_Province_Mindanao.html,tourist_sites,,/Profile/joya63,Joy A,Family,",19 April 2023"
2,Philippine Eagle Center,Davao City,5.0,,Exploring at the Philippine eagle center 🦅 ,As for our experience we enjoyed a lot and spend our time for exploring different collection of birds and animals. The environment is very peaceful and clean. The tour guides are friendly and gave us more knowledge. Highly recommended we will visit again next time.,Apr 2023,/ShowUserReviews-g298459-d320865-r886758263-Philippine_Eagle_Center-Davao_City_Davao_del_Sur_Province_Mindanao.html,tourist_sites,,/Profile/Odyssey63799354629,Odyssey63799354629,,",18 April 2023"
3,Philippine Eagle Center,Davao City,5.0,,"Visit the Eagles, support the community through souvenirs","We went to the Philippine Eagle Foundation's centre in Davao today. It was stunning and a great way to explore the tropical local flora and fauna. We were able to see families of monkeys frolicking in their habitat, and of course, the eagles and the important breeding program.",Dec 2022,/ShowUserReviews-g298459-d320865-r872464863-Philippine_Eagle_Center-Davao_City_Davao_del_Sur_Province_Mindanao.html,tourist_sites,,/Profile/sheldont685,Sheldon T,Couples,",22 December 2022"
4,Philippine Eagle Center,Davao City,5.0,,The Rising Eagle of Asia,I had the opportunity to travel to Davao City in the Philippines and it was an amazing experience. The city is full of life and there is so much to see and do. I would definitely recommend anyone who has the chance to visit Davao City. Here are some of the highlights from my trip: ,Jan 2022,/ShowUserReviews-g298459-d320865-r866071742-Philippine_Eagle_Center-Davao_City_Davao_del_Sur_Province_Mindanao.html,tourist_sites,,/Profile/hourglassexpeditions,hourglassexpeditions,,",26 October 2022"
5,Philippine Eagle Center,Davao City,3.0,,Amazing Birds,"We were in the area so we decided to add this to our itinerary. The birds were very majestic, but a quick lap around the Center and you're done. Be prepared for 2 fees (I think the first is for parking, and the second is to enter the center). Great cause.",Oct 2022,/ShowUserReviews-g298459-d320865-r865349320-Philippine_Eagle_Center-Davao_City_Davao_del_Sur_Province_Mindanao.html,tourist_sites,,/Profile/3sammyp,Sammy P,,",21 October 2022"
6,Philippine Eagle Center,Davao City,4.0,,Philippine Eagles!!!,You want eagles.. plenty gorgeous Philippine eagles here where you can see them up close..   Hope the govt can add more funds to this center to improve its condition for more successful breeding and to effectively campaign for our eagles.,Jul 2022,/ShowUserReviews-g298459-d320865-r858396397-Philippine_Eagle_Center-Davao_City_Davao_del_Sur_Province_Mindanao.html,tourist_sites,,/Profile/netteprince,netteprince,,",4 September 2022"
7,Philippine Eagle Center,Davao City,5.0,,Lovely place for learning,"The crew that maintained and served at the Philippine Eagle Center is just amazing--so courteous and helpful. We were relieved to see the animals and birds well cared for. To maximize your time, bring a hat or an umbrella, a hat, wet wipes (dispose of these properly!), a fan (it can get terribly humid), and an insect repellant (because wildlife and a lush garden of trees and plants attract all kinds of insects.",May 2022,/ShowUserReviews-g298459-d320865-r840799309-Philippine_Eagle_Center-Davao_City_Davao_del_Sur_Province_Mindanao.html,tourist_sites,,/Profile/995janetv,Janet V,,",31 May 2022"
8,Philippine Eagle Center,Davao City,3.0,,"Actually in Calinan, not Davao",35 km from Davao you need a taxi go get there. Entrance to park is 15 pedo and second entrance for vaccinated is 160. 200 for unvaccinated ,May 2022,/ShowUserReviews-g298459-d320865-r839728000-Philippine_Eagle_Center-Davao_City_Davao_del_Sur_Province_Mindanao.html,tourist_sites,,/Profile/excess5,excess5,Friends,",24 May 2022"
9,Philippine Eagle Center,Davao City,3.0,,Captive animals were in great shape. However it was not clear where we ought to go or what should we do,"We booked a 9 am Mabuhay tour (150 php for fully vaccinated guests, 300 php if not). However we weren't sure if we joined the wrong group or were we supposed to go on our own? Given that the package says Mabuhay tour we are expecting to be joined by a tour guide, maybe it should be clarified on the e-ticket.",Jan 2022,/ShowUserReviews-g298459-d320865-r823672389-Philippine_Eagle_Center-Davao_City_Davao_del_Sur_Province_Mindanao.html,tourist_sites,,/Profile/Tabbybugs,Tabby,Couples,",2 January 2022"
10,Philippine Eagle Center,Davao City,,,,,,,tourist_sites,,,,,
11,Malagos Garden Resort,Davao City,5.0,,Super awesome place for birding!,"While the original plan was to hike trails at the foot of Mt. Apo, I was redirected to this ""gem"" in Malagos instead.  The expansive resort is home to various flora and fauna. The resort hosts daily bird watching activities and has recorded sixty plus bird species, one of which, is the star bird Southern Silvery Kingfisher. Very friendly staff. Food was fantastic. A must try dish is the ""Linotlot na Manok"". I enjoyed staying in the lodge near the creek, as the flowing water, rustling leaves and bird calls are true music to the ears! Thank you Malagos staff for the memorable experience!",Jul 2023,/ShowUserReviews-g298459-d549335-r912881710-Malagos_Garden_Resort-Davao_City_Davao_del_Sur_Province_Mindanao.html,tourist_sites,,/Profile/markanthonym709,Mark Anthony M,Solo,",25 August 2023"
12,Malagos Garden Resort,Davao City,5.0,,Excellent Customer Service,We had an enjoyable and memorable stay in this Garden Resort. They have clean room and very attentive staff. ,Aug 2023,/ShowUserReviews-g298459-d549335-r912062466-Malagos_Garden_Resort-Davao_City_Davao_del_Sur_Province_Mindanao.html,tourist_sites,,/Profile/padayhaghomeschool,Joi P,,",21 August 2023"
13,Malagos Garden Resort,Davao City,4.0,,Family Staycation,"This is not first time here, but we keep on coming back since we enjoyed the bird show and the food. Staff are friendly. Rooms are clean but you have to put mat or rags in CR area. ",Feb 2023,/ShowUserReviews-g298459-d549335-r887354442-Malagos_Garden_Resort-Davao_City_Davao_del_Sur_Province_Mindanao.html,tourist_sites,,/Profile/yamaleihs,yamaleihs,Family,",23 April 2023"
14,Malagos Garden Resort,Davao City,5.0,,Indeed an Anniversary to remember ❤️,"We really had a great experience at your resort. Every penny we spent was all worth it. Thank you for your excellent service, Malagos Garden Resort ❤️",Jan 2023,/ShowUserReviews-g298459-d549335-r887314612-Malagos_Garden_Resort-Davao_City_Davao_del_Sur_Province_Mindanao.html,tourist_sites,,/Profile/LMEC28,Leunice C,,",23 April 2023"
15,Malagos Garden Resort,Davao City,4.0,,"Great service, okay attractions, bad ants","I had visited Malagos Resort before but never stayed there. The staff were helpful and attentive. The family suite was beautiful with a king bed in one room, 2 twins in the other and a wonderful view of the river. You could go to sleep listening to the water. The food was pretty good, prices high but not terrible. The butterfly attraction was wonderful and full of butterflies! The playground attractions needed work  some are so broken down they are a safety hazard. The petting zoo was completely closed. The bird show was great and chocolate making was fun. We had fun feeding the fish and the birds in the aviary. They had high chairs in the restaurants for my 1 year old.  The biggest negative was there was a large colony of black ants in our suite. No way to get rid of them, cleaning came and kept sweeping them up and using chalk to keep them on the roof, but we had to live with them just crawling around up there the whole time. ",Jan 2023,/ShowUserReviews-g298459-d549335-r886705083-Malagos_Garden_Resort-Davao_City_Davao_del_Sur_Province_Mindanao.html,tourist_sites,,/Profile/horselovernai,horselovernai,Family,",18 April 2023"
16,Malagos Garden Resort,Davao City,2.0,,😬,Little to no water for almost 8hrs.,Jan 2023,/ShowUserReviews-g298459-d549335-r886382590-Malagos_Garden_Resort-Davao_City_Davao_del_Sur_Province_Mindanao.html,tourist_sites,,/Profile/illenmae0611,illenmae0611,,",15 April 2023"
17,Malagos Garden Resort,Davao City,5.0,,Excellent and quality service since my first experience 2017,The manager and all the staff are hospitable and super accommodating. ,Mar 2023,/ShowUserReviews-g298459-d549335-r886245695-Malagos_Garden_Resort-Davao_City_Davao_del_Sur_Province_Mindanao.html,tourist_sites,,/Profile/zhair2023,Zhai R,,",14 April 2023"
18,Malagos Garden Resort,Davao City,5.0,,Great experience for kids,"Wish we had more time here as we did only a half a day tour.  The kids enjoyed the bird feeding the most, while mine was the butterfly garden.  ",Apr 2023,/ShowUserReviews-g298459-d549335-r885992395-Malagos_Garden_Resort-Davao_City_Davao_del_Sur_Province_Mindanao.html,tourist_sites,,/Profile/chinkeec2016,Chinkee C,,",12 April 2023"
19,Malagos Garden Resort,Davao City,5.0,,Nice place to relax and enjoy nature ,"Nice place to relax and enjoy nature. The room is big, the breakfast buffet is good, the staff are nice. Manager Nina goes out of her way to make sure you are having a good time. Always come back",Apr 2023,/ShowUserReviews-g298459-d549335-r885589620-Malagos_Garden_Resort-Davao_City_Davao_del_Sur_Province_Mindanao.html,tourist_sites,,/Profile/Departure60551233037,jim,Family,",10 April 2023"
20,Malagos Garden Resort,Davao City,5.0,,Awesome resort,Great day out. So much to see and do for the whole family. The buffet lunch was outstanding great selection very tasty and not forgetting the chocolate museum outlining the history of this famous chocolate.,Apr 2023,/ShowUserReviews-g298459-d549335-r885404950-Malagos_Garden_Resort-Davao_City_Davao_del_Sur_Province_Mindanao.html,tourist_sites,,/Profile/V7832TIstephenj,Stephen J,Couples,",9 April 2023"
21,Malagos Garden Resort,Davao City,,,,,,,tourist_sites,,,,,
22,Davao Crocodile Park,Davao City,3.0,,August 2023 visit - please improve the conditions for the animals and heal the ones that are not in good condition,"Whilst it is an interesting place to visit the animals need a lot more love and attention and more space to run around. It is always a dilemma whether to visit animals in captivity. If they are kept in captivity then it’s important that they are kept well and a healthy condition maintained.  This place is always a nice spot to call to in Davao but I would hope this day and age that the environment for the animals would be much better and those that are clearly suffering (poor condition ostriches, small cages of lions and tigers, etc.) because of the small spaces are tended to, maybe even put somewhere else so they can properly recover.",Aug 2023,/ShowUserReviews-g298459-d550275-r907896480-Davao_Crocodile_Park-Davao_City_Davao_del_Sur_Province_Mindanao.html,tourist_sites,,/Profile/theodolite2000,theodolite2000,Family,",4 August 2023"
23,Davao Crocodile Park,Davao City,3.0,,In Need Of Investigation,"After many years, I revisited this place with my extended family and children. I must say it has really been neglected and the cages are pitiful for a few of the animals. As a member of OFI and AOP, the poor Orangutan was in a disgusting cage and should be rehabilitated. I spent a long time studying this wonderful primate with Dr Galdikas and I sponsor three in Borneo.  I will follow this up with the foundation.   The Lion and Lioness are another exhibit which is small and disgusting. This is the King of the jungle which needs space and so sad to see this in this day and age.   The Tiger had a little area to run which was better than its counterparts. Hands on feeding of Koi fish, Rabbits, Ostrich was good and the play area was lovely for the children. If you are into crocodiles, there is plenty of them and as in Australia we have crocodile farms, I didn’t find the selling of items any different than what is done in other parts of the world. This small zoo really needs investigating with regards to the caring and housing of their animals.  I definitely will be contacting appropriate authorities in relation to this.",May 2023,/ShowUserReviews-g298459-d550275-r892655657-Davao_Crocodile_Park-Davao_City_Davao_del_Sur_Province_Mindanao.html,tourist_sites,,/Profile/Xanerin,Xanerin,Family,",30 May 2023"
24,Davao Crocodile Park,Davao City,5.0,,Crocodile a plenty here,A must visit here in Davao. The entrance fee is 350.00 pesos a bit pricey compared to Philippine Eagle. ,Apr 2023,/ShowUserReviews-g298459-d550275-r886818311-Davao_Crocodile_Park-Davao_City_Davao_del_Sur_Province_Mindanao.html,tourist_sites,,/Profile/joya63,Joy A,Friends,",19 April 2023"
