,name,location,rating,rating_date,title,content,visit_date,url,type,ratingDate,user_link,user_name,purpose,review_date
81,Green Windows Dormitel,Davao City,3.0,,Budget Friendly Hotel with its own charm,"The room is really small. We had a difficult time finding space for our luggage. It does not have a window. It is really budget friendly. It is located near restaurants, convenience stores, laundry shops, bars, and grocery stores. The entrance to the building is a little bit confusing. The hotel employs persons with disabilities. The internet was weak at times but is OK. The hotel staff are very friendly and always smiling. It is clean and has its own charm.",August 2019,/ShowUserReviews-g298459-d2413589-r707036203-Green_Windows_Dormitel-Davao_City_Davao_del_Sur_Province_Mindanao.html,hotel,Sep 2019,,,,
82,Green Windows Dormitel,Davao City,3.0,,"Was a guest from these inclusive dates of August 5-8, 2019.","It's a backpacker of 6 double decks and room is quite cold, which I prefer. However I have to request a maintenance staff to clean the toilet as I was told they do it every 2pm only which is unthinkable knowing people would come and go. And i think I have mistakenly left my powerbank called Silvertec placed in a blue pocket/pouch. Can someone from the desk asks the staff if they found one and send me sms at 09272512719, please.  Thank you,  Abelardo B. Andolong",August 2019,/ShowUserReviews-g298459-d2413589-r699496471-Green_Windows_Dormitel-Davao_City_Davao_del_Sur_Province_Mindanao.html,hotel,Aug 2019,,,,
83,Green Windows Dormitel,Davao City,3.0,,No window & no complementary mineral water,"Despite the rules and regulations to govern the accreditation of hotels, tourists inns - executive order no. 120 in relation to republic act no. 7160, we had no bottles of Drinking Water and glasses in the bedroom. I had to insist to get it at front desk.  No window that open directly to open air & sunlight.",July 2019,/ShowUserReviews-g298459-d2413589-r693603379-Green_Windows_Dormitel-Davao_City_Davao_del_Sur_Province_Mindanao.html,hotel,Jul 2019,,,,
84,Green Windows Dormitel,Davao City,5.0,,My Experience,The staff was great very accommodating and also the place of the hotel was convenient (near the 7/11 and malls) the room as well is so clean and i feel so safe because of the 24/7 security (Two Thumbs Up) and i will go back next time for sure,June 2019,/ShowUserReviews-g298459-d2413589-r683895364-Green_Windows_Dormitel-Davao_City_Davao_del_Sur_Province_Mindanao.html,hotel,Jun 2019,,,,
85,Green Windows Dormitel,Davao City,5.0,,I ❤️ Green Windows Hotel,"If you’re a backpacker, traveler or among others that simply finds an affordable and nice place to stay in then, I highly recommend “GWH”. The fact that they’re a budget friendly hotel, they’re also have a good location; near malls and downtown areas. They have a good and refreshing ambiance starting from the front desk area up to their state of the art rooms and facilities. Me and my friends was happy to observed that their staffs were very accommodating and hospitable. We’re very impressed with the cleanliness and orderliness of our room. Overall, we’re very satisfied with our stay and we’re looking forward to come back. From booking down to check-out, this establishment is guaranteed a must try.",May 2019,/ShowUserReviews-g298459-d2413589-r683887341-Green_Windows_Dormitel-Davao_City_Davao_del_Sur_Province_Mindanao.html,hotel,Jun 2019,,,,
86,Green Windows Dormitel,Davao City,4.0,,very Good,I love the place and the rooms are clean and organized. Friendly staffs and approachable. The hotel is accessible with free parking area for the guests with cars. Security is 24/7.. They booked me even if I just called without downpayment.,April 2018,/ShowUserReviews-g298459-d2413589-r651479315-Green_Windows_Dormitel-Davao_City_Davao_del_Sur_Province_Mindanao.html,hotel,Feb 2019,,,,
87,Green Windows Dormitel,Davao City,2.0,,Book online!,"We stay at their Family Room. I regret not booking rooms in advance. Here's a tip: You should book online, there's a big price difference. By the way, the room is cozy but the bathroom is slippery and the lighting is dark. Sadly, no complimentary bottled water and no hangers. You have to prepare 500php for the deposit.",November 2018,/ShowUserReviews-g298459-d2413589-r635139481-Green_Windows_Dormitel-Davao_City_Davao_del_Sur_Province_Mindanao.html,hotel,Nov 2018,,,,
88,Green Windows Dormitel,Davao City,5.0,,First Davao Trip,They made my first Davao trip a lot easier and very memorable. From our early check-in and allowing us to leave our baggages when we checked out. I also love how the place is near malls and certain places I can go to in the city. It was really the best choice I have ever made when I chose where to stay in Davao.,October 2018,/ShowUserReviews-g298459-d2413589-r632317241-Green_Windows_Dormitel-Davao_City_Davao_del_Sur_Province_Mindanao.html,hotel,Nov 2018,,,,
89,Green Windows Dormitel,Davao City,4.0,,"Affordable, Cheap and clean. Good for backpackers","Highly recommended for those looking budget-friendly hotel. Clean and affordable hotel nearby the city. Easily accessible. Its my second time in Davao, and same hostel i stayed. Thank you Greenwindows! ",October 2018,/ShowUserReviews-g298459-d2413589-r631842986-Green_Windows_Dormitel-Davao_City_Davao_del_Sur_Province_Mindanao.html,hotel,Nov 2018,,,,
90,Blue Lotus Hotel,Davao City,5.0,,the view,"What truly sets a nice hotel apart is its exceptional service. The staff is attentive, courteous, and anticipates your needs before you even express them. Whether you require assistance with arranging transportation, booking tickets to local attractions, or simply seeking recommendations for nearby points of interest, the concierge is knowledgeable and eager to assist.",August 2023,/ShowUserReviews-g298459-d16732328-r912762255-Blue_Lotus_Hotel-Davao_City_Davao_del_Sur_Province_Mindanao.html,hotel,24 Aug,,,,
91,Blue Lotus Hotel,Davao City,5.0,,The best Halal and Muslim friendly hotel in Davao ,"I stayed in Blue Lotus Hotel in July 2023 for one night, although I  frequently visited their Sky View Restaurant. I had a great experience. The room was quite spacious, approximately 30 sq metres. The elevator is one of a kind where you do not need to touch it but simply use your RFID-enabled hotel keycard. I believe this was for sanitizing measures taken by the hotel management since the pandemic era.   The room has qiblah direction on the ceiling, and they provide Muslim travellers with prayer mats as well as Holy Quran. Very thoughtful touch since none of the hotels in Davao City provide this in their room.   The housekeeping staff were also attentive and it took less than 10 minutes for them to deliver the iron & board.    The hotel has a Malaysian Chef, Chef Shah who cooks",July 2023,/ShowUserReviews-g298459-d16732328-r905463893-Blue_Lotus_Hotel-Davao_City_Davao_del_Sur_Province_Mindanao.html,hotel,Jul 2023,,,,
92,Blue Lotus Hotel,Davao City,5.0,,Peaceful Place,"Secure, friendly hotel with solid restaurant and workout facilities. Rooms were clean, large, and comfortable.  The SkyView manager was particularly helpful to our group on our last night when we needed some flexibility in their policies to have the evening we very much needed. We kept staff beyond the end of their paid shift, I am sure.   I hope to visit Davao again, and I will certainly stay at the Blue Lotus.",January 2023,/ShowUserReviews-g298459-d16732328-r876126678-Blue_Lotus_Hotel-Davao_City_Davao_del_Sur_Province_Mindanao.html,hotel,Jan 2023,,,,
93,Blue Lotus Hotel,Davao City,4.0,,Recommended,"We had an issue regarding the hotel’s implementation of safety and security measures (the only reason for the 4-star rating). Hotel staff was very accommodating except for the lady (I didn’t get her name) who was assigned in the buffet breakfast area. She waits by the entrance (counter) and has the list of the hotel guests, she was a bit rude. Special shout-out to Miss George (I hope I got her name right), we were able to get a room upgrade, thank you! Very roomy and comfortable.",October 2022,/ShowUserReviews-g298459-d16732328-r867513378-Blue_Lotus_Hotel-Davao_City_Davao_del_Sur_Province_Mindanao.html,hotel,Nov 2022,,,,
94,Blue Lotus Hotel,Davao City,4.0,,Getting better after the pandemic,"I was happy staying here after a long timely abstinence because of Covid-19. Slowly but surely in this hotel, times are getting back to normal. A big congratulations to the whole staff during the best it could too.",April 2022,/ShowUserReviews-g298459-d16732328-r837011859-Blue_Lotus_Hotel-Davao_City_Davao_del_Sur_Province_Mindanao.html,hotel,May 2022,,,,
95,Blue Lotus Hotel,Davao City,3.0,,Found small cockroach,"Stayed for few days here. Location is good. Security is friendly as well as the bellman.   Room is neat and clean, but there is awful smell of cigarette in the hallway and inside the room.  My husband found a small cockroach in the side table.   2 water is complimentary. The rest you have to pay. Tea is not available in this hotel. And we’re having a hard time since phone is not working, so we still have to go down or call them using our personal number to request something.",January 2022,/ShowUserReviews-g298459-d16732328-r826277624-Blue_Lotus_Hotel-Davao_City_Davao_del_Sur_Province_Mindanao.html,hotel,Jan 2022,,,,
96,Blue Lotus Hotel,Davao City,3.0,,So-so,"The room provided is not always consistent but with the same description which is a disappointment. The food is not that good and needs improvement given that it's really expensive, we would expect atleast a 9/10 star quality meal.  Pros: clean and modern  Overall the stay is okay room service gets delayed though",June 2021,/ShowUserReviews-g298459-d16732328-r792281409-Blue_Lotus_Hotel-Davao_City_Davao_del_Sur_Province_Mindanao.html,hotel,Jun 2021,,,,
97,Blue Lotus Hotel,Davao City,5.0,,Luxurious Boutique Hotel,"I stayed in Blue Lotus during the COVID-19 pandemic and this hotel is just obsessed with cleanliness from the main lobby guards, reception, elevators up to your room... everything is sanitized! My room reminded me of a Korean drama (K-Drama) where every feature is conveniently high technology. You can avail of guest services (housekeeping, room service, etc) through your room TV and should you need to adjust the room temperature, all you need to do is call the front desk and they can adjust it for your remotely. My suite is clean, full of amenities one can find in luxurious hotels and while lacking of a good view, the hotel service makes up for it. Checking in and out was breeze as well. Will definitely stay in Blue Lotus again!  ",November 2020,/ShowUserReviews-g298459-d16732328-r777770105-Blue_Lotus_Hotel-Davao_City_Davao_del_Sur_Province_Mindanao.html,hotel,Nov 2020,,,,
98,Blue Lotus Hotel,Davao City,5.0,,High Tech!,"I remember the place when I visited China in October 2019. The hotel equipped with excellent room fittings and amenities were very nice and comfortable. I stayed one of the junior suite of the hotel and the bed is really relaxing. The buffet was owe some, value for money indeed.",November 2019,/ShowUserReviews-g298459-d16732328-r749472331-Blue_Lotus_Hotel-Davao_City_Davao_del_Sur_Province_Mindanao.html,hotel,Mar 2020,,,,
99,Blue Lotus Hotel,Davao City,4.0,,You wont be blue in Blue Lotus🤗🤗🤗,"The hotel from the looks of it is just a little over a year old. Its conveniently Located along the highway , so its not so hard to find. The lobby is quite spacious with welcoming staff . The rooms are adequate and very clean . For its price , I would say its value for money ! ",February 2020,/ShowUserReviews-g298459-d16732328-r746200601-Blue_Lotus_Hotel-Davao_City_Davao_del_Sur_Province_Mindanao.html,hotel,Feb 2020,,,,
100,Go Hotels Lanang-Davao,Davao City,5.0,,Your convenient and safe space for events,"Our easy to go place may it be business or leisure. Convenience and safety.   Excellent customer service - The staff was friendly, attentive, and went above and beyond to ensure a pleasant stay.  Delicious dining options - The on-site restaurants served delectable dishes, catering to various tastes and dietary preferences.  Prompt responsiveness to requests - The staff promptly addressed any inquiries or needs, ensuring a pleasant and organized event.  I highly recommend booking your events to them. Affordable, organized and hospitable.",June 2023,/ShowUserReviews-g298459-d10724062-r906890533-Go_Hotels_Lanang_Davao-Davao_City_Davao_del_Sur_Province_Mindanao.html,hotel,Jul 2023,,,,
101,Go Hotels Lanang-Davao,Davao City,3.0,,Nice room and restaurant in the lobby,"I'm a regular guest of Go Hotels in various parts of the country and I highly recommend their cozy and affordable rooms. This one at Davao Lanang may not be close to Robinson's Mall (unlike other Go Hotels), but there are good restaurants in the area by the parking lot. The restaurant at the lobby is particularly nice. I liked its foods and ambiance. The place is also close to the airport (just 10mins away by taxi).",April 2023,/ShowUserReviews-g298459-d10724062-r888676392-Go_Hotels_Lanang_Davao-Davao_City_Davao_del_Sur_Province_Mindanao.html,hotel,May 2023,,,,
102,Go Hotels Lanang-Davao,Davao City,1.0,,No longer the GoHotels I knew -- this was TERRIBLE,"We used to frequent at GoHotels (other branches) many years ago so I know that it’s a reputable hotel. But this time, COME ON. They renovated the exterior and lobby of GH Lanang to look new but the rooms are way too old. I paid 4,100+ for 2 nights and it was not worth it - TERRIBLE at that.  I didn’t sleep well because of the room state and avoided using the toilet and shower as much as I could because just look at the photos and be the judge. Not only did it look bad, it also smelled bad. On my 2nd morning, I kindly requested for room service but the staff informed me that they only do room service on a guests’s 3rd day but I was only on a 3D2N stay so I figured I wasn’t qualified. I went on and requested that the CR at least be sprayed with air freshener because it was smelly",February 2023,/ShowUserReviews-g298459-d10724062-r880136709-Go_Hotels_Lanang_Davao-Davao_City_Davao_del_Sur_Province_Mindanao.html,hotel,Feb 2023,,,,
103,Go Hotels Lanang-Davao,Davao City,2.0,,Affordable but can be a bit uncomfortable ,"Affordable. Comfortable beds. Good air-condition. Good internet. Water dispenser at corridor.    Can't say that it is great because: - no hooks inside the toilet and shower! OK is solo but if you are with someone, they may see you naked upon entering and leaving the shower. Not even a hook to bring a towel inside!  - puddle/poor drainage at toilet - slight stains - slow check-in",December 2022,/ShowUserReviews-g298459-d10724062-r872589075-Go_Hotels_Lanang_Davao-Davao_City_Davao_del_Sur_Province_Mindanao.html,hotel,Dec 2022,,,,
104,Go Hotels Lanang-Davao,Davao City,4.0,,Overnight stay at Go hotel,"This GoHotel is a lot better than the one I last stayed in Bacolod. Very basic amenities, but no soap, shampoo and toothbrush. Location is good. Breakfast in the cafe is ordinary. There are a lot of restaurants just outside. Good value still.",October 2022,/ShowUserReviews-g298459-d10724062-r868616143-Go_Hotels_Lanang_Davao-Davao_City_Davao_del_Sur_Province_Mindanao.html,hotel,Nov 2022,,,,
105,Go Hotels Lanang-Davao,Davao City,3.0,,"""a night in Go Hotel""","We've stayed here for a night and it was a great stay since the whole room is clean and kinda cozy. However, the internet Wi-Fi here is so slow and even the mobile phones here were low to no signal at all. After all, it still great since the hotel staff during the check in and out are very accommodating and I can certainly says that they definitely clean the rooms after the guest checks in and they're fast and honest as that time I forgot some of my stuff and they immediately gave it to me.",October 2022,/ShowUserReviews-g298459-d10724062-r867446349-Go_Hotels_Lanang_Davao-Davao_City_Davao_del_Sur_Province_Mindanao.html,hotel,Nov 2022,,,,
106,Go Hotels Lanang-Davao,Davao City,5.0,,Thumbs up for Go Hotel Lang Davao,"The hotel staff during check in and check out is fast,accomodating and very well mannered. The room is clean, hot water is great!descent comfy,clean bed,the ONLY DOWNSIDE if your room is situated near the open air lounge fronting elevator ALL the Noise unnecessary chaos at wee hours from ignorant guests! Hope they can do something on that. Sundays resto is in groundfloor a bit pricey with bland food but convenient enough to provide food to your hunger pangs,otherwise across the hotel are food strip lining up..limited choice though. Overall HOTEL is great! Will recommend and stay again in the future!",May 2022,/ShowUserReviews-g298459-d10724062-r840432087-Go_Hotels_Lanang_Davao-Davao_City_Davao_del_Sur_Province_Mindanao.html,hotel,May 2022,,,,
107,Go Hotels Lanang-Davao,Davao City,1.0,,Low to No Signal - All Networks,"I've stayed here several times and signals of all mobile networks are low to no signal at all -- be it at the front part or back part (worst) of the building. To make it worse, the in-house wifi is very, very very slow.",May 2022,/ShowUserReviews-g298459-d10724062-r838893848-Go_Hotels_Lanang_Davao-Davao_City_Davao_del_Sur_Province_Mindanao.html,hotel,May 2022,,,,
108,Go Hotels Lanang-Davao,Davao City,5.0,,Holyweek Staycation,"We stayed at GoHotel Lanang for 3nights good for 4rooms last HolyWeek. I would to commend the Front desk, Ms Margaret, Ms Joan & Ms Marinel (Housekeeping) and the Guards on duty for the kindness and for attending to our needs.  We just have our very comfy stay, wfi & cable tv, moreover, the staff is so helpful.  God bless & more power! Wahlie Diaz",April 2022,/ShowUserReviews-g298459-d10724062-r835797301-Go_Hotels_Lanang_Davao-Davao_City_Davao_del_Sur_Province_Mindanao.html,hotel,Apr 2022,,,,
109,Go Hotels Lanang-Davao,Davao City,5.0,,Hellow Again Davao,"After 3years been back again here in Davao City. Thank you  to our sales Manager recommending to me GO HOTEL. They have a wide space of room( sorry dont have a picture)especially the queen size bed and its clean,very approachable and accommodating front desk and  a cozy restaurant while having your breakfast.  If ever for my next business trip in Davao i will surely be back  in GO HOTEL.  More power Go hotel!",April 2022,/ShowUserReviews-g298459-d10724062-r833973314-Go_Hotels_Lanang_Davao-Davao_City_Davao_del_Sur_Province_Mindanao.html,hotel,Apr 2022,,,,
110,Hotel Uno,Davao City,4.0,,Hotel Uno Kadayawan Stay,"Place is strategically located along the parade route for the kadayawan festivities. Its also most of the public transportation passed by. So moving around wouldnt be difficult. Locals are friendly, if you get lost just ask politely. Fares are universal for public transport but make sure to bring loose bills like extra coins to limit hassle transactions.   The property is outdated though and theres no bidet in the bathroom. They dont have concierge thus make sure to packed lightly. Theres 1 lift available to move between floors. Price was a bit high due to the peak demands as the property was fully booked. Need to check the AC upon check in as the 1st room I got AS was working but cannot cool the room in itself. Upon technician visit, they were kind enough to accommodate me on",August 2023,/ShowUserReviews-g298459-d3522371-r912954984-Hotel_Uno-Davao_City_Davao_del_Sur_Province_Mindanao.html,hotel,Yesterday,,,,
111,Hotel Uno,Davao City,4.0,,Davao Vacation (My GF Mothers 70th B-day),"Value for money. Staffs are good hospitable. Complimentary breakfast is delicious (in my opinion). Room(s) are good but cr have small cockroaches that goes out from the ceiling (I guess) I also love hotel environment , outside there are many establishment ex. banks , 7/11 and transportation is available 24/7. Internet - There are rooms that have no wifi signal (my first room have net signal but disconnecting every single time). So I changed room that is near to wifi access point.    Hotel Rate 8.5/10 ",April 2023,/ShowUserReviews-g298459-d3522371-r891676763-Hotel_Uno-Davao_City_Davao_del_Sur_Province_Mindanao.html,hotel,May 2023,,,,
112,Hotel Uno,Davao City,3.0,,Toilets need upgrading,"Location is great because it is close to the night market, Aldevinco, San Pedro Cathedral and Bangkerohan where we enjoyed eating Durian, bought mangosteen, pomelos and lanzones which were all very cheap because this season was bountiful.  But the toilets badly need an upgrade. No shower curtain so the whole toilet and bath is wet. No toilet paper holder too so we requested for a plastic chair where we can place the toilet paper and our clothes.  Sheets look and smell clean.  We didn’t avail of the breakfast so no comment on that",October 2019,/ShowUserReviews-g298459-d3522371-r716671003-Hotel_Uno-Davao_City_Davao_del_Sur_Province_Mindanao.html,hotel,Oct 2019,,,,
113,Hotel Uno,Davao City,5.0,,Best stay we ever have,"This is Our First Time in Davao City, Searching for a place to stay ,takes forever, We plan to stay at Hotel uno  for  2 to 3 Days , but we change our plans we stay there for 2 weeks. If I can give more stars I will. We explore Davao to General Santos , The place in the heart of Davao , and so the Staff of Hotel Uno,Thank You so much, from Gonzales and Morrow family . My from can’t thank you enough keep up the good work. God Bless.",April 2019,/ShowUserReviews-g298459-d3522371-r676452857-Hotel_Uno-Davao_City_Davao_del_Sur_Province_Mindanao.html,hotel,May 2019,,,,
114,Hotel Uno,Davao City,3.0,,Hotel Uno - You get what you pay for,"Located in one of the busiest streets. Old rooms and bathrooms. The hotel needs an upgrade. Poor cable signal.  Poor to no wifi connection. Free breakfast, good selection. Price is okay. Friendly and attentive staff. Good for overnight or short stay. Walking distance to the Roxas night market and Aldevinco shopping center and Marco Polo.",March 2019,/ShowUserReviews-g298459-d3522371-r663933040-Hotel_Uno-Davao_City_Davao_del_Sur_Province_Mindanao.html,hotel,Apr 2019,,,,
115,Hotel Uno,Davao City,3.0,,"Cosy Hotel Uno, Davao City",Nice small cosy hotel in the commercial area of Davao.  Rooms are small but for the price you pay 850pesos you won’t complain.  Lighting in the rooms could be brighter.  Room service is provided and you can order from the menu provided.  There is a nice Coffee shop at the lobby serving a good number of dishes with amazing prices again.  Very polite staff and door person is always willing to help with your bags.  You really get a good deal when you stay here.,January 2019,/ShowUserReviews-g298459-d3522371-r650026807-Hotel_Uno-Davao_City_Davao_del_Sur_Province_Mindanao.html,hotel,Feb 2019,,,,
116,Hotel Uno,Davao City,4.0,,One of the Best in the Lower Budget Category,"I frequently stayed in this hotel whenever I am Davao. The location is convenient for me as it is very close to Roxas Blvd, Malls, ATMs and their downtown area. The receptionist and housekeeping are warm and pleasant. The room was clean and comfortable. TV Channels are sufficient. The only CONS are, there are a lot, like a lot of small cockroaches and their WiFi speeds are slower than normal.",January 2019,/ShowUserReviews-g298459-d3522371-r644483192-Hotel_Uno-Davao_City_Davao_del_Sur_Province_Mindanao.html,hotel,Jan 2019,,,,
117,Hotel Uno,Davao City,1.0,,"Imagine your worst hotel experience, I promise this is worse!","The room is so dark, cable doesn’t work, and don’t even get me started on their lame excuse of a WiFi.  They even charge for extra creamer. They cannot serve you toast with their Filipino Breakfast on the menu “because of the system.” What system???  I’m never coming back here ever again.",November 2018,/ShowUserReviews-g298459-d3522371-r633485227-Hotel_Uno-Davao_City_Davao_del_Sur_Province_Mindanao.html,hotel,Nov 2018,,,,
118,Hotel Uno,Davao City,3.0,,Hotel Oh No or Yes,"Located strategically in the heart of Davao City. Transportation going to main locations in the city is available. Room is decent although compact, bed is okay and cr is kinda clean. Budget friendly too. Recommended for not stagy people. ",July 2018,/ShowUserReviews-g298459-d3522371-r627363566-Hotel_Uno-Davao_City_Davao_del_Sur_Province_Mindanao.html,hotel,Oct 2018,,,,
119,Hotel Uno,Davao City,4.0,,Strength: Very strategic location,"Pros: -Located in the downtown. Walking distance from Aldevinco, Roxas Street, Davao Museum, People's Park, has jeepneys passing thru outside the hotel which makes places accessible -Courteous staff at the front desk -Spacious room -High pressure of shower (with hot & cold) -Tasty breakfast -Could order beers at night in the restau  Cons: -Not well-lighted room -Cable TV is not working (but if you 're not after watching, there will be no problem) -Odd smell of the toilet -Rooms are really basic (1 towel for the whole duration of stay, unless you request to change your towel) -No free bottled water (but purified water is available at the hallway)  You might opt to go back again if your priority is accessibility to tourist sites.",August 2018,/ShowUserReviews-g298459-d3522371-r618087101-Hotel_Uno-Davao_City_Davao_del_Sur_Province_Mindanao.html,hotel,Sep 2018,,,,
