,name,location,rating,rating_date,title,content,visit_date,url,type,ratingDate,user_link,user_name,purpose,review_date
0,Madayaw Cafe,Davao City,5.0,"August 26, 2023",White-glove service from the moment you walk in to the moment you leave.,"I felt welcome the entire time I was there, and this is the biggest differentiating factor for me. No matter the amenities, technology, comfort, or even food, a restaurant cannot reach the pinnacle of its success without its most important resource: People. I must make...a special mention of Jubb. This young man is an outstanding host, and an even better human being. He is a credit to your image and reputation, and a key to your future success. I could not be more satisfied and grateful for his kindness, attentiveness, professionalism, and authenticity. Jubb treated me with white-glove service at every opportunity. I never felt neglected or ignored. Every business needs someone like him, and your restaurant is distinctly fortunate to have him. He deserves great recognition for impressive service.",Date of visit:,/ShowUserReviews-g298459-d17329235-r912927410-Madayaw_Cafe-Davao_City_Davao_del_Sur_Province_Mindanao.html,restaurant,,,,,
1,Madayaw Cafe,Davao City,5.0,"August 25, 2023",US TIME at Madayaw cafe,The selection of food was delicious and the coffee was amazing. Service attendants Flerisse and Trisia were very attentive.. My husband and I had a great time enjoying our us time..,Date of visit:,/ShowUserReviews-g298459-d17329235-r912729359-Madayaw_Cafe-Davao_City_Davao_del_Sur_Province_Mindanao.html,restaurant,,,,,
2,Madayaw Cafe,Davao City,5.0,"August 24, 2023",August 20-22 stay,"This place did not disappoint. Would gladly come back here from time to time!

Big thanks to Regina for assisting me when I was getting my Lunch, she was kind enough to assist me on what was the best in the menu. Service was top...notch!",Date of visit:,/ShowUserReviews-g298459-d17329235-r912640964-Madayaw_Cafe-Davao_City_Davao_del_Sur_Province_Mindanao.html,restaurant,,,,,
3,Madayaw Cafe,Davao City,5.0,"August 19, 2023",Dusit_D2 Kadayawn_2023,"This place is great! Hotel staff are accomodating. Had a fabulous stay.

Thanks to Kenjie for the great service at the Cocktails on the Pool side",Date of visit:,/ShowUserReviews-g298459-d17329235-r911447855-Madayaw_Cafe-Davao_City_Davao_del_Sur_Province_Mindanao.html,restaurant,,,,,
4,Madayaw Cafe,Davao City,5.0,"August 19, 2023",Great Service,"The food was all masarap, and the service was very good. Sha was a very helpful staff member helping us with an unusual non food request!",Date of visit:,/ShowUserReviews-g298459-d17329235-r911338143-Madayaw_Cafe-Davao_City_Davao_del_Sur_Province_Mindanao.html,restaurant,,,,,
5,Madayaw Cafe,Davao City,5.0,"August 6, 2023",Amazing place!,People are really helpful and they hace amazing food. When you ask for something different they try to give whatever you want!,Date of visit:,/ShowUserReviews-g298459-d17329235-r908186711-Madayaw_Cafe-Davao_City_Davao_del_Sur_Province_Mindanao.html,restaurant,,,,,
6,Madayaw Cafe,Davao City,5.0,"August 5, 2023","Fantastic views, modern aesthetics, and most importantly, great food selection fit for everyone’s needs. Worth it 👌",I celebrated my birthday here in this place and I can definitely say that the staff are quite accomodating and quite helpful with our needs during our event. Fantastic private rooms with quite a pleasant aesthetic to match! Great tasting food and relaxing environment overall....All worth it! Would come back again soon 👌,Date of visit:,/ShowUserReviews-g298459-d17329235-r908026731-Madayaw_Cafe-Davao_City_Davao_del_Sur_Province_Mindanao.html,restaurant,,,,,
7,Madayaw Cafe,Davao City,4.0,"July 29, 2023","Its a wonderful experience, we really refer this to friends & relatives","Great food,great service & great venue. We are properly inform of the protocols . Assigned waiter is nice and courteous",Date of visit:,/ShowUserReviews-g298459-d17329235-r906432538-Madayaw_Cafe-Davao_City_Davao_del_Sur_Province_Mindanao.html,restaurant,,,,,
8,Madayaw Cafe,Davao City,5.0,"July 23, 2023",Quality buffet at DusitD2 Madayaw Cafe,"Excellent food and excellent service!

It’s our second time to have our dinner buffet here. This time with our son.  Quality and choices of food available are great for a dinner buffet.",Date of visit:,/ShowUserReviews-g298459-d17329235-r904991538-Madayaw_Cafe-Davao_City_Davao_del_Sur_Province_Mindanao.html,restaurant,,,,,
9,Madayaw Cafe,Davao City,5.0,"July 23, 2023",Highly recommended,Great ambience. Awesome food selections. Ken was outstanding in serving us! Really appreciate all you did today!,Date of visit:,/ShowUserReviews-g298459-d17329235-r904989922-Madayaw_Cafe-Davao_City_Davao_del_Sur_Province_Mindanao.html,restaurant,,,,,
10,Madayaw Cafe,Davao City,5.0,"July 16, 2023",Madayaw sa Dusit!,"Madayaw Resto at Dusit Thani was a delightful experience. It has extensive variety of dishes offered for everyone's taste buds, from fresh fruits to superb main course. The ambiance was pleasant, creating a relaxed and enjoybale atmosphere.",Date of visit:,/ShowUserReviews-g298459-d17329235-r903413403-Madayaw_Cafe-Davao_City_Davao_del_Sur_Province_Mindanao.html,restaurant,,,,,
11,Madayaw Cafe,Davao City,5.0,"July 16, 2023",Dine with dusit,Food are delicious. The ambaince is relaxing and the staffs are accomodating and responsive specialy aren,Date of visit:,/ShowUserReviews-g298459-d17329235-r903396984-Madayaw_Cafe-Davao_City_Davao_del_Sur_Province_Mindanao.html,restaurant,,,,,
12,Madayaw Cafe,Davao City,5.0,"July 13, 2023",Hello Davao,Food is delicious. Excellent service. Hospitable staff specially RJ. My latte is so yummy.  It makes my day happy .,Date of visit:,/ShowUserReviews-g298459-d17329235-r902573316-Madayaw_Cafe-Davao_City_Davao_del_Sur_Province_Mindanao.html,restaurant,,,,,
13,Madayaw Cafe,Davao City,5.0,"July 8, 2023",Food is Good,"Food is good, the service is great especially sir aren who gave us the crab crackers and also their dinner ends in 9:30.",Date of visit:,/ShowUserReviews-g298459-d17329235-r901404872-Madayaw_Cafe-Davao_City_Davao_del_Sur_Province_Mindanao.html,restaurant,,,,,
14,Madayaw Cafe,Davao City,5.0,"July 3, 2023",Very much satisfied,"Service was excellent. All the staff was so accommodating. We’re so happy and full! Shout out to all the staff of Madayaw, Y’all are great!",Date of visit:,/ShowUserReviews-g298459-d17329235-r899895388-Madayaw_Cafe-Davao_City_Davao_del_Sur_Province_Mindanao.html,restaurant,,,,,
15,Waling Waling Cafe - Acacia Hotel Davao,Davao City,5.0,"August 10, 2023",Waling-Waling,"Waling-Waling is very nice and pleasant restaurant, There Waiter here is very approachable and makes you feel like home. Its a great service. Thank you and I will recommend to my friends too.",Date of visit:,/ShowUserReviews-g298459-d23579215-r909175905-Waling_Waling_Cafe_Acacia_Hotel_Davao-Davao_City_Davao_del_Sur_Province_Mindana.html,restaurant,,,,,
16,Waling Waling Cafe - Acacia Hotel Davao,Davao City,5.0,"August 5, 2023",Comfortable Stay,Both the place and the food are great! I especially love the breakfast meal! All foods offered were delicious! The crew are also kind and very attentive!,Date of visit:,/ShowUserReviews-g298459-d23579215-r907891014-Waling_Waling_Cafe_Acacia_Hotel_Davao-Davao_City_Davao_del_Sur_Province_Mindana.html,restaurant,,,,,
17,Waling Waling Cafe - Acacia Hotel Davao,Davao City,5.0,"August 2, 2023",Good,"Good spot,friendly people and even the environment is nice and comfy. Love to visit and experience it again",Date of visit:,/ShowUserReviews-g298459-d23579215-r907284005-Waling_Waling_Cafe_Acacia_Hotel_Davao-Davao_City_Davao_del_Sur_Province_Mindana.html,restaurant,,,,,
18,Waling Waling Cafe - Acacia Hotel Davao,Davao City,5.0,"August 2, 2023",Recommended hotel,"They offer a handful of choices of food and tastes great!  They offer wide choices of bread and viand, in which I always go for whenever I stay in this hotel.",Date of visit:,/ShowUserReviews-g298459-d23579215-r907279848-Waling_Waling_Cafe_Acacia_Hotel_Davao-Davao_City_Davao_del_Sur_Province_Mindana.html,restaurant,,,,,
19,Waling Waling Cafe - Acacia Hotel Davao,Davao City,5.0,"August 2, 2023",Thank You Acacia Hotel,"Food were good. Spacious,comfy Spotless clean room, Very kind, hospitable staff.Great service. Would difinitely choose this hotel again on my future stay .",Date of visit:,/ShowUserReviews-g298459-d23579215-r907276055-Waling_Waling_Cafe_Acacia_Hotel_Davao-Davao_City_Davao_del_Sur_Province_Mindana.html,restaurant,,,,,
20,Waling Waling Cafe - Acacia Hotel Davao,Davao City,5.0,"August 2, 2023",Breakfast at waling-waling,"Great variety of food selections. Great. Hospitality at its best.
No beer allowed in the rooms.
Happy to be back again.",Date of visit:,/ShowUserReviews-g298459-d23579215-r907274452-Waling_Waling_Cafe_Acacia_Hotel_Davao-Davao_City_Davao_del_Sur_Province_Mindana.html,restaurant,,,,,
21,Waling Waling Cafe - Acacia Hotel Davao,Davao City,5.0,"July 30, 2023",happy tummy!,the waiters and waitresses are attentive and polite.  they pick the soiled plates quickly which make the breakfast table clean and more cozy to stay.,Date of visit:,/ShowUserReviews-g298459-d23579215-r906648670-Waling_Waling_Cafe_Acacia_Hotel_Davao-Davao_City_Davao_del_Sur_Province_Mindana.html,restaurant,,,,,
22,Waling Waling Cafe - Acacia Hotel Davao,Davao City,5.0,"July 28, 2023",Excellent Experience,Great experience. Great food! Wide range of food options for breakfast. Rooms are big as well. Thank you!,Date of visit:,/ShowUserReviews-g298459-d23579215-r906083029-Waling_Waling_Cafe_Acacia_Hotel_Davao-Davao_City_Davao_del_Sur_Province_Mindana.html,restaurant,,,,,
23,Waling Waling Cafe - Acacia Hotel Davao,Davao City,5.0,"July 28, 2023",We stayed here for 5days and fr the entire stay the food is superb! room is super spacious and clean,We stayed here for 5days and fr the entire stay the food is superb! room is super spacious and clean,Date of visit:,/ShowUserReviews-g298459-d23579215-r906082011-Waling_Waling_Cafe_Acacia_Hotel_Davao-Davao_City_Davao_del_Sur_Province_Mindana.html,restaurant,,,,,
24,Waling Waling Cafe - Acacia Hotel Davao,Davao City,5.0,"July 23, 2023",Excellent experience as always,I always love the food in waling waling cafe. Staffs are very hospitable and approachable specially ma'am Christine. She assisted my request very well and I give her 5 star for that.,Date of visit:,/ShowUserReviews-g298459-d23579215-r904879497-Waling_Waling_Cafe_Acacia_Hotel_Davao-Davao_City_Davao_del_Sur_Province_Mindana.html,restaurant,,,,,
25,Waling Waling Cafe - Acacia Hotel Davao,Davao City,5.0,"July 23, 2023",Review,"Best customer service. The attendants are super attentive and very kind, thank you so much will dine again especially to Ms. Christine! Thanks",Date of visit:,/ShowUserReviews-g298459-d23579215-r904877843-Waling_Waling_Cafe_Acacia_Hotel_Davao-Davao_City_Davao_del_Sur_Province_Mindana.html,restaurant,,,,,
26,Waling Waling Cafe - Acacia Hotel Davao,Davao City,5.0,"July 21, 2023",Its good,"The food is good, the breakfast has a wide selection of different variations of fruits, bread, and viands.",Date of visit:,/ShowUserReviews-g298459-d23579215-r904431828-Waling_Waling_Cafe_Acacia_Hotel_Davao-Davao_City_Davao_del_Sur_Province_Mindana.html,restaurant,,,,,
27,Waling Waling Cafe - Acacia Hotel Davao,Davao City,5.0,"July 21, 2023",Breakfast At Waling Waling,Very Accommodating and The food Is Great. Hoping the Food Selection is Wider and Much more Diverse..,Date of visit:,/ShowUserReviews-g298459-d23579215-r904431696-Waling_Waling_Cafe_Acacia_Hotel_Davao-Davao_City_Davao_del_Sur_Province_Mindana.html,restaurant,,,,,
28,Waling Waling Cafe - Acacia Hotel Davao,Davao City,5.0,"July 21, 2023",nice,"Great for family vacation, must go especially there food is nice and the place is relaxing and the staff r nice",Date of visit:,/ShowUserReviews-g298459-d23579215-r904431674-Waling_Waling_Cafe_Acacia_Hotel_Davao-Davao_City_Davao_del_Sur_Province_Mindana.html,restaurant,,,,,
29,Waling Waling Cafe - Acacia Hotel Davao,Davao City,5.0,"July 18, 2023",Birthday celebration,"Delicious food
Excellent waiter
Good ambiance
Friendly staff and waiters
Very accomadating
By leoven",Date of visit:,/ShowUserReviews-g298459-d23579215-r903911690-Waling_Waling_Cafe_Acacia_Hotel_Davao-Davao_City_Davao_del_Sur_Province_Mindana.html,restaurant,,,,,
30,Siam Lounge,Davao City,5.0,"August 23, 2023",Nice place to relax,Staffs are very accommodating specially Britney. Drinks are so good and I like the ambiance of the lounge.,Date of visit:,/ShowUserReviews-g298459-d17185512-r912304088-Siam_Lounge-Davao_City_Davao_del_Sur_Province_Mindanao.html,restaurant,,,,,
31,Siam Lounge,Davao City,5.0,"August 5, 2023",Excellent experience,Very nice and well-maintained establishment with excellent hospitality service from the wonderful Shane on the F&B side and Melody from the Spa facility.  Will definitely come back without hesitation. Daghang salamat/Sawadee ka!,Date of visit:,/ShowUserReviews-g298459-d17185512-r907932778-Siam_Lounge-Davao_City_Davao_del_Sur_Province_Mindanao.html,restaurant,,,,,
32,Siam Lounge,Davao City,5.0,"August 2, 2023",EXCELLENT FOOD AND SERVICE,"Amazing place where you can eat breakfast, very affordable price and delicious food. You can choose whatever you want. And the most exciting part is our waitress named Relyn is very accommodating and helpful. she help us to choose what to eat. She help my...mom and dad which is senior already. I really miss this place.",Date of visit:,/ShowUserReviews-g298459-d17185512-r907414710-Siam_Lounge-Davao_City_Davao_del_Sur_Province_Mindanao.html,restaurant,,,,,
33,Siam Lounge,Davao City,5.0,"August 1, 2023",Engagement Dinner,"Every time I dine here , Siam Lounge always provide good and quality services. What a great experience! The ambience is really elegant. The staffs are very hospitable especially Shane , I will never forget this girl who witnessed the special moment of how me...and my fiancé met. I would like to give a big appreciation to her for being so hardworking , friendly , humble and her character really suits in hospitality industry. I highly recommend this place as well. The cocktails ? The best! Thank you Philip the bartender for mixing the drinks very well it’s hella good and for sure we will recommend your mix to our corporate friends. Come and experience the Siam way! I will surely come back soon!",Date of visit:,/ShowUserReviews-g298459-d17185512-r907102892-Siam_Lounge-Davao_City_Davao_del_Sur_Province_Mindanao.html,restaurant,,,,,
34,Siam Lounge,Davao City,5.0,"July 31, 2023",Siam Lounge,Philip the Bartender surprised me with his awesome Gin and Tonic. Wow 5 star. The mix and the citrus makes this drinks the best in Davao . I will be back  for sure. One of Davaos  must try.,Date of visit:,/ShowUserReviews-g298459-d17185512-r906974653-Siam_Lounge-Davao_City_Davao_del_Sur_Province_Mindanao.html,restaurant,,,,,
35,Siam Lounge,Davao City,5.0,"July 26, 2023",Loving it here.,My favorite place to be. Stayed in Dusit Thani for  summer . I always look forward to hang out in Siam Lounge. Mark (bartender) make the best mango Margarita. Their supervisor Joy is super sweet. Her smile lights the whole lounge. She is such a...sweetheart and very helpful so accommodating. She always make me feel special. The lounge is so relaxing perfect place to hang out with friends and family. Listening to music/piano is the best while having dinner with my favorite drink of course. I will miss Siam Lounge when I go home for sure. I haven’t left this hotel yet and I already wanted to go back❤️,Date of visit:,/ShowUserReviews-g298459-d17185512-r905709955-Siam_Lounge-Davao_City_Davao_del_Sur_Province_Mindanao.html,restaurant,,,,,
36,Siam Lounge,Davao City,5.0,"July 25, 2023",Best Merienda Buffet and Best Service to keep,"Me and my 3 friends dine/tried again the Merienda Buffet @ Siam Lounge. Pur second time to dine. Nice place to meet with friends. The buffet was filled much of Filipino Snacks. 

We were very happy of the excellent service provided by Ms. Joy, my...friends and I were able to talk comfortably and our requests personally attended. Thank you so much you deserve recognition as you always go above and beyond on your duties to treat the hotel guests, and you are a valuable asset to the hotel and my primary reason fo staying and coming back again.

She always smiles even on her busiest time (insert a smile with a heart).
She's a keeper. Nothing beats great service.",Date of visit:,/ShowUserReviews-g298459-d17185512-r905479571-Siam_Lounge-Davao_City_Davao_del_Sur_Province_Mindanao.html,restaurant,,,,,
37,Siam Lounge,Davao City,5.0,"June 18, 2023",Excellent,Thank you for the excellent service Joy Mier. The mango shake tastes very good. I would rate the experience a 10/10.,Date of visit:,/ShowUserReviews-g298459-d17185512-r895673840-Siam_Lounge-Davao_City_Davao_del_Sur_Province_Mindanao.html,restaurant,,,,,
38,Siam Lounge,Davao City,5.0,"June 17, 2023",Cocktails,"My mom and I went for drinks, and our bartender Philip was very friendly and accommodating. The drinks were made perfectly.",Date of visit:,/ShowUserReviews-g298459-d17185512-r895562042-Siam_Lounge-Davao_City_Davao_del_Sur_Province_Mindanao.html,restaurant,,,,,
39,Siam Lounge,Davao City,5.0,"June 14, 2023",Amazing Ambiance,"Excellent service , very accommodating and great entertainers for tonight. We recommend this Bar for making us happy as we celebrated my niece graduation day. Thank you Ma'am Joy for making it extra special. Thanks to.your staff. We will come back again with my whole...family. I will recommend everyone to visit as we really enjoy our night.",Date of visit:,/ShowUserReviews-g298459-d17185512-r895038733-Siam_Lounge-Davao_City_Davao_del_Sur_Province_Mindanao.html,restaurant,,,,,
40,Siam Lounge,Davao City,4.0,"June 6, 2023",Nice - But Not For Me,"Lovely ambience and enjoyed the pianist and singer while we were there. Ordered Scotch and Soda and got scotch on ice. Staff seemed confused so ordered Soda water.   Didn’t actually find it very friendly and seemed like a place where people pretending to be better...than others go, so didn’t stay long.",Date of visit:,/ShowUserReviews-g298459-d17185512-r893719947-Siam_Lounge-Davao_City_Davao_del_Sur_Province_Mindanao.html,restaurant,,,,,
41,Siam Lounge,Davao City,5.0,"June 3, 2023",Siam lounge sublime,"“Anna and the King” is a must try for your evening cocktail., a hint of unexpected spice. Would I order it again? Definitely, as long as Phillip makes it for me. Absolute star! The rest of the staff were brilliant too. Special mention to Niña,...Queennie,Joseph, Lovely, Shane, Relyn and Vin of Siam lounge. Also, Diego and Mark of concierge and the guards  who are great ambassadors for the hotel and have made our stay here a complete pleasure.",Date of visit:,/ShowUserReviews-g298459-d17185512-r893214020-Siam_Lounge-Davao_City_Davao_del_Sur_Province_Mindanao.html,restaurant,,,,,
42,Siam Lounge,Davao City,5.0,"May 17, 2023",Amazing people,"Philip, Relyn and Quennie are entertained me a lot during my stay here. All the staff are friendly, helpful and approachable. One of the must try (if you love to drink) is the Philip's cocktails, they're amazing!! You will also be entertained by Relyn ans...Quennie when you sit at the bar. You will definitely enjoy your stay here.",Date of visit:,/ShowUserReviews-g298459-d17185512-r890692158-Siam_Lounge-Davao_City_Davao_del_Sur_Province_Mindanao.html,restaurant,,,,,
43,Siam Lounge,Davao City,5.0,"April 27, 2023",Visiting every month,"Their staff ""Relyn"" is very helpful and approachable.
She helped me avail the discount and helped me pick some good food.",Date of visit:,/ShowUserReviews-g298459-d17185512-r887956035-Siam_Lounge-Davao_City_Davao_del_Sur_Province_Mindanao.html,restaurant,,,,,
44,Siam Lounge,Davao City,5.0,"April 24, 2023",Salamat ,"So lovely place, Nice music, friendly staffs, great food and original cocktails.Salamat for the good time!",Date of visit:,/ShowUserReviews-g298459-d17185512-r887489085-Siam_Lounge-Davao_City_Davao_del_Sur_Province_Mindanao.html,restaurant,,,,,
45,Benjarong Bar and Restaurant Davao,Davao City,5.0,"August 14, 2023","Wonderful Birthday , We will surely comeback",Had a wonderful time .It was my birthday and they made sure to make it extra special . They are very welcoming and accommodating to our needs.,Date of visit:,/ShowUserReviews-g298459-d19324002-r910218831-Benjarong_Bar_and_Restaurant_Davao-Davao_City_Davao_del_Sur_Province_Mindanao.html,restaurant,,,,,
46,Benjarong Bar and Restaurant Davao,Davao City,5.0,"July 30, 2023",Best Thai Dining experience in Davao City!,This restaurant is the crown jewel of Dusit hotel as it features some of the best and most delicious Thai food in Davao City. Thank you Rhona for creating an amazing and memorable dining experience for my family and me!,Date of visit:,/ShowUserReviews-g298459-d19324002-r906687706-Benjarong_Bar_and_Restaurant_Davao-Davao_City_Davao_del_Sur_Province_Mindanao.html,restaurant,,,,,
47,Benjarong Bar and Restaurant Davao,Davao City,5.0,"July 26, 2023",Dinner at Benjarong,"Had a wonderful time at Dusit Davao last night. Great food, ambiance and excellent service as always!",Date of visit:,/ShowUserReviews-g298459-d19324002-r905637280-Benjarong_Bar_and_Restaurant_Davao-Davao_City_Davao_del_Sur_Province_Mindanao.html,restaurant,,,,,
48,Benjarong Bar and Restaurant Davao,Davao City,5.0,"July 26, 2023",1st time inside,"The food taste great and the services is great too, the view is great and the pool is beautiful clear water and the security is great.",Date of visit:,/ShowUserReviews-g298459-d19324002-r905607342-Benjarong_Bar_and_Restaurant_Davao-Davao_City_Davao_del_Sur_Province_Mindanao.html,restaurant,,,,,
49,Benjarong Bar and Restaurant Davao,Davao City,5.0,"July 18, 2023","Celebrating another added year at Benjarong, Dusit Thani Davao","Celebrating my 24th Birthday with a blast! Thank You Ben Jarong Dusit Thani, Davao for the sumptuous and memorable Dining experience. The Thai inspired ambiance indeed give us elegant comfort ❤️☺️

Special Thanks to Ms. Rexelle Arriesgado for the warmth welcome, such a very attentive...and responsive manager all the time 😇

Benjarong is offering also mock-tails and cocktails. We had our cocktails mixed by Jay-Ar and this, absolutely the talks of the circle of your friends once you sip, swirl and swallow! The best and Flavorful 😋

Exceeding more of my expectations about Dusit Thani, Davao! One of the best experiences you will love to reminisce about all your life 😇🥰🎂",Date of visit:,/ShowUserReviews-g298459-d19324002-r903819679-Benjarong_Bar_and_Restaurant_Davao-Davao_City_Davao_del_Sur_Province_Mindanao.html,restaurant,,,,,
50,Benjarong Bar and Restaurant Davao,Davao City,5.0,"July 17, 2023",Great food…great service,Excellent and attentive service. Food is fresh and prepared to order. Rana is fantastic. We’ve been lucky to have her both times we’ve dined here.,Date of visit:,/ShowUserReviews-g298459-d19324002-r903691166-Benjarong_Bar_and_Restaurant_Davao-Davao_City_Davao_del_Sur_Province_Mindanao.html,restaurant,,,,,
51,Benjarong Bar and Restaurant Davao,Davao City,5.0,"July 17, 2023",awesome,"all good, the place is so relax with acoustic band. all staff is friendly. specially Ms. Rexelle arriesgado thank you to accommodating us. i’ll be back and i recommend this to my friends. Thank you..",Date of visit:,/ShowUserReviews-g298459-d19324002-r903624934-Benjarong_Bar_and_Restaurant_Davao-Davao_City_Davao_del_Sur_Province_Mindanao.html,restaurant,,,,,
52,Benjarong Bar and Restaurant Davao,Davao City,5.0,"July 17, 2023",Good and excellent service,"I had a wonderful Birthday celebration with my friends at Benjarong Thai and Bar restaurant here in Dusit Thani Davao.

We had so much fun having their live band while jamming with them, the staff are all accommodating specially the Bar Man JR who served...our cocktails.

The food was so delicious and had a very authentic Thai taste, The restaurant is so relaxing and the ambience was very warm because of the smiling, attentive, courteous and friendly atmosphere that the staff gave us.

I would like to say thank you for a memorable Birthday I had here in Benjarong.

The Lady manager led the team well thank you Ms. Rexelle",Date of visit:,/ShowUserReviews-g298459-d19324002-r903610705-Benjarong_Bar_and_Restaurant_Davao-Davao_City_Davao_del_Sur_Province_Mindanao.html,restaurant,,,,,
53,Benjarong Bar and Restaurant Davao,Davao City,5.0,"July 17, 2023",Great Satisfaction 💯,"Had a  great dining experience with my friends Delicious Food + Excellent Service + Exquisite Ambience a total satisfaction.

We love the way the restaurant staff attends our needs Kudos Benjarong Davao 

Special thanks to the head Ms. Rexelle💯",Date of visit:,/ShowUserReviews-g298459-d19324002-r903595409-Benjarong_Bar_and_Restaurant_Davao-Davao_City_Davao_del_Sur_Province_Mindanao.html,restaurant,,,,,
54,Benjarong Bar and Restaurant Davao,Davao City,5.0,"July 16, 2023",thanks ma'am rexelle,"great experience, well priced for the experience and food, nice staff and very accompanying experience and food",Date of visit:,/ShowUserReviews-g298459-d19324002-r903422230-Benjarong_Bar_and_Restaurant_Davao-Davao_City_Davao_del_Sur_Province_Mindanao.html,restaurant,,,,,
