,name,location,rating,rating_date,title,content,visit_date,url,type,ratingDate,user_link,user_name,purpose,review_date
273,Blue Post Boiling Crabs and Shrimps,Davao City,5.0,"January 9, 2020",Lunch,"Three of us had lunch and it was excellent. We feasted on grilled salmon, spicy chicken soup, grilled pork ribs and calamari. Service was prompt, servers were pleasant and we had food to take home. This was a return visit and we'll go again.",Date of visit:,/ShowUserReviews-g298459-d5982621-r738068204-Blue_Post_Boiling_Crabs_and_Shrimps-Davao_City_Davao_del_Sur_Province_Mindanao.html,restaurant,,,,,
274,Blue Post Boiling Crabs and Shrimps,Davao City,4.0,"November 11, 2019",Crab is amazing!,"Our first agenda after arriving in Davao was to have lunch at Blue Post Boiling Crabs & Shrimp near SM Lanang. The garlic fried crab was so good. We also ordered a pound of blue post shrimp, lemon butter shrimp, liempo and a pomelo salad....I would say it was our best meal in Davao. A bit pricey - our entire meal was almost P1000 per head (we were 6 pax).",Date of visit:,/ShowUserReviews-g298459-d5982621-r725612055-Blue_Post_Boiling_Crabs_and_Shrimps-Davao_City_Davao_del_Sur_Province_Mindanao.html,restaurant,,,,,
275,Blue Post Boiling Crabs and Shrimps,Davao City,5.0,"September 30, 2019",One of Davao’s Finest Resto,The foods (shrimps and crabs) are superb although it’s a little bit pricey. Has a good ambience and 5 stars for quality service. The restaurant is just along JP Laurel Ave. and more or less 30 min drive from the airport. A perfect place for...your love ones.,Date of visit:,/ShowUserReviews-g298459-d5982621-r714103861-Blue_Post_Boiling_Crabs_and_Shrimps-Davao_City_Davao_del_Sur_Province_Mindanao.html,restaurant,,,,,
276,Blue Post Boiling Crabs and Shrimps,Davao City,4.0,"September 22, 2019",Best Grilled Stuffed Squip,"Great food and a bit pricy.
Crabs and shrimps really are fresh.
Cooked perfectly because the meat comes off the shells easily.
Good place for family and big groups. 
The grilled stuffed squid here is probably the best that I had, no need for a...sauce.
Limited parking space outside.
Wear a bib and gloves while eating, or better yet use your bare hands for a more fun experience.
A must try for everyone.",Date of visit:,/ShowUserReviews-g298459-d5982621-r711803985-Blue_Post_Boiling_Crabs_and_Shrimps-Davao_City_Davao_del_Sur_Province_Mindanao.html,restaurant,,,,,
277,Blue Post Boiling Crabs and Shrimps,Davao City,5.0,"September 15, 2019",Dining Out at Blueposts Boiling Crabs & Shrimp,"While visiting Davao, Philippines the week of 9/8/2019 through 9/14/2019, we made a decision to dine out at a restaurant that we drove by on Tuesday, 9/10/2019 and ate at on Wednesday Evening, 9/11/2019.  They feature live blue crabs, fish, shrimp, mussels and a variety...of other seafoods available to consume.  The host covered our table in plastic and placed plastic gloves over our hands.  We chose a blue crab (live of course) with tiger shrimp and mussels (which was much more than we could ever expect to see or eat).  In conjunction with that, I had a Bread Bowl with seafood in a broth.  I drank Spring Water in a bottle (as this is what I usually drink), whereas with my wife, she drank a Watermelon Smoothie.",Date of visit:,/ShowUserReviews-g298459-d5982621-r709792281-Blue_Post_Boiling_Crabs_and_Shrimps-Davao_City_Davao_del_Sur_Province_Mindanao.html,restaurant,,,,,
278,Blue Post Boiling Crabs and Shrimps,Davao City,1.0,"August 15, 2019",Disappointing!,"Its like an expensive fast food joint.   The taste not remarkable, the quality so-so.  At 2300 a kilo for the crabs, i was expecting fresh, succulent and fleshy crabs.  We ordered two, one was okay, the other one was a dehydrated crab... all shells, very...little meat.  The rice was a sorry lump of grains stuck together (overwatered; malabsa).  I am so disappointed with this restaurant.  I dont know why it is rated #14 in Davao...",Date of visit:,/ShowUserReviews-g298459-d5982621-r699216897-Blue_Post_Boiling_Crabs_and_Shrimps-Davao_City_Davao_del_Sur_Province_Mindanao.html,restaurant,,,,,
279,Blue Post Boiling Crabs and Shrimps,Davao City,4.0,"August 14, 2019",Crustacean Menu and the Rest,"Crabs, shrimps, chicken, pork, beef and whatever you are looking for even feast on durians, mangosteens the list goes on... Must visit and taste the food offered on their menu. Ready to use all your hands and beware not to bite your fingers...",Date of visit:,/ShowUserReviews-g298459-d5982621-r698737180-Blue_Post_Boiling_Crabs_and_Shrimps-Davao_City_Davao_del_Sur_Province_Mindanao.html,restaurant,,,,,
280,Blue Post Boiling Crabs and Shrimps,Davao City,5.0,"August 13, 2019",Yum yum yum seafoods,"Big delicious servings. A bit pricey but worth the price. Ambiance also good, into the sea feels. Spicy crabs in garlic or butter will always be the best!",Date of visit:,/ShowUserReviews-g298459-d5982621-r698592982-Blue_Post_Boiling_Crabs_and_Shrimps-Davao_City_Davao_del_Sur_Province_Mindanao.html,restaurant,,,,,
281,Blue Post Boiling Crabs and Shrimps,Davao City,4.0,"July 30, 2019",We come here for the crabs and shrimps,"We like the garlic fried crab and shrimps.  If you don't mind the mess, try it with their cajun spice sauce. It is quite expensive but that is expected for seafood of this type.  You get what you pay for.",Date of visit:,/ShowUserReviews-g298459-d5982621-r693989618-Blue_Post_Boiling_Crabs_and_Shrimps-Davao_City_Davao_del_Sur_Province_Mindanao.html,restaurant,,,,,
282,Blue Post Boiling Crabs and Shrimps,Davao City,4.0,"May 8, 2019",Crabs ,"There was wrong order-taking by the waiter which made our bill even more expensive but other than that food was good. 

The place can be a bit cleaner but then again eating crab can be really messy. 

Its pricier than the other restaurants here but...if you want crabs, you should try this place",Date of visit:,/ShowUserReviews-g298459-d5982621-r672320302-Blue_Post_Boiling_Crabs_and_Shrimps-Davao_City_Davao_del_Sur_Province_Mindanao.html,restaurant,,,,,
283,Blue Post Boiling Crabs and Shrimps,Davao City,3.0,"March 24, 2019","Average taste, a bit pricey","We ordered 640 grams of crabs and half chicken and we paid more than 2k. The taste was fairly average but we enjoyed how spicy it is. The place looked messy, the decor was so random. We appreciate how friendly the waiter was tho. 

There...are better restaurants around that serve crabs and seafood.",Date of visit:,/ShowUserReviews-g298459-d5982621-r660793121-Blue_Post_Boiling_Crabs_and_Shrimps-Davao_City_Davao_del_Sur_Province_Mindanao.html,restaurant,,,,,
284,Blue Post Boiling Crabs and Shrimps,Davao City,3.0,"February 20, 2019",Great Service,The food for me is average but the servers are friendly and service is excellent. We did not order the crab which they say is their specialty. The shrimp was okay but the grilled chicken is a little dry for my taste. Tuna was good.,Date of visit:,/ShowUserReviews-g298459-d5982621-r653639742-Blue_Post_Boiling_Crabs_and_Shrimps-Davao_City_Davao_del_Sur_Province_Mindanao.html,restaurant,,,,,
285,"Tong Yang, SM Davao Ecoland",Davao City,5.0,"July 1, 2023",Superb!!!,Celebrated our 9th anniversary here in Tongyang! Thank you to the Chefs and Servers for assisting us all through out! You guys are the best! Longlive!! Gonna go home with a happy heart and warmtg smile tonight ❤️,Date of visit:,/ShowUserReviews-g298459-d12812599-r899433311-Tong_Yang_SM_Davao_Ecoland-Davao_City_Davao_del_Sur_Province_Mindanao.html,restaurant,,,,,
286,"Tong Yang, SM Davao Ecoland",Davao City,5.0,"June 18, 2023",Amazing and great experience,What a great variety of food and what a such amazing experience! Just like a family! Thank you to the servers and to the Chef’s! Shout out to Chef Mesty for assisting us all thru out! Long liveTongYang! 🎉,Date of visit:,/ShowUserReviews-g298459-d12812599-r895661114-Tong_Yang_SM_Davao_Ecoland-Davao_City_Davao_del_Sur_Province_Mindanao.html,restaurant,,,,,
287,"Tong Yang, SM Davao Ecoland",Davao City,5.0,"April 5, 2023","Accomodating staffs and good choices of food on their displays, reasonable price and deliciously made foods.","The restaurant is great. Accomodating staffs, even though theyre busy but still have the time to assist us putting a smile on faces by hitting funny punchlines that makes our day good. We will definitely be back. Thank yoh!",Date of visit:,/ShowUserReviews-g298459-d12812599-r884917617-Tong_Yang_SM_Davao_Ecoland-Davao_City_Davao_del_Sur_Province_Mindanao.html,restaurant,,,,,
288,"Tong Yang, SM Davao Ecoland",Davao City,5.0,"February 19, 2023",Best buffet restaurant in Davoo City,"Complete your stay in Davao with this delicious food from Tong Yang, located at SM City Davao. Open from 11am to 9pm Sunday to Thursday. 11am to 10pm Friday and Saturday.",Date of visit:,/ShowUserReviews-g298459-d12812599-r879239445-Tong_Yang_SM_Davao_Ecoland-Davao_City_Davao_del_Sur_Province_Mindanao.html,restaurant,,,,,
289,"Tong Yang, SM Davao Ecoland",Davao City,5.0,"January 20, 2023",Accomodating staffs,"Friendly staffs and delicious cuisines, perfect for friends and family bonding. They even helped me making the soup which i really loved. Thank you",Date of visit:,/ShowUserReviews-g298459-d12812599-r875729601-Tong_Yang_SM_Davao_Ecoland-Davao_City_Davao_del_Sur_Province_Mindanao.html,restaurant,,,,,
290,"Tong Yang, SM Davao Ecoland",Davao City,5.0,"January 15, 2023",Happy Celebrant,"Good ambiance
Very approachable employees
They serve very well
I love the place and all the foods they serve. 
Highly recommended",Date of visit:,/ShowUserReviews-g298459-d12812599-r875155546-Tong_Yang_SM_Davao_Ecoland-Davao_City_Davao_del_Sur_Province_Mindanao.html,restaurant,,,,,
291,"Tong Yang, SM Davao Ecoland",Davao City,5.0,"January 6, 2023",Best Buffet in Davao City!💖,"If you want a value for money buffet this is the best buffet restaurant you will find in Davao City the only buffet with authentic taste of shabux2.

With different varieties of bbq meats for grill in their very own marinating sauce.

Plus Tempura, Japanese...Maki, cook filipino Asian Cuisine   native desserts, halo halo, ice cream and cakes!! 

Oh with unlimited beeeeeeer!

With a very accommodating  staff 😘

Happy and satisfied tummy here🤗😋",Date of visit:,/ShowUserReviews-g298459-d12812599-r874119852-Tong_Yang_SM_Davao_Ecoland-Davao_City_Davao_del_Sur_Province_Mindanao.html,restaurant,,,,,
292,"Tong Yang, SM Davao Ecoland",Davao City,5.0,"October 24, 2022",Happy Eating,"Best Customer Service 😊 
kudos to Robert,  very accomodating 😊
Foods are highly recomended 😍

Friendly kaayo ang mga staff bisan yagaw na among mga bata 👍🏻👍🏻👍🏻",Date of visit:,/ShowUserReviews-g298459-d12812599-r865781812-Tong_Yang_SM_Davao_Ecoland-Davao_City_Davao_del_Sur_Province_Mindanao.html,restaurant,,,,,
293,"Tong Yang, SM Davao Ecoland",Davao City,3.0,"August 19, 2022",Not worth it sorrry,"People should know that not all know how to do the "" shabu shabu"" way. Customer service is bad and the food selection is not that great. They should keep an eye or atleast give instructions to all customers on how to do it ,...their menu is also not very helpful. Taste is bland and the restaurant is just OVERHYPED.",Date of visit:,/ShowUserReviews-g298459-d12812599-r854965198-Tong_Yang_SM_Davao_Ecoland-Davao_City_Davao_del_Sur_Province_Mindanao.html,restaurant,,,,,
294,"Tong Yang, SM Davao Ecoland",Davao City,5.0,"March 7, 2020",Great Buffet,"If you cannot find food you like, I would be surprised.   Service was good, quality of food is good and value for money it is!   I'll go again.",Date of visit:,/ShowUserReviews-g298459-d12812599-r749631757-Tong_Yang_SM_Davao_Ecoland-Davao_City_Davao_del_Sur_Province_Mindanao.html,restaurant,,,,,
295,"Tong Yang, SM Davao Ecoland",Davao City,4.0,"March 6, 2020",Awesome variety of dishes,"I drop by there because of an incident. I was really surprised finding so many different choices AND a well trained and friendly staff. When in SM Davao Ecoland, Tong Yang PLUS  is really recommended.",Date of visit:,/ShowUserReviews-g298459-d12812599-r749377112-Tong_Yang_SM_Davao_Ecoland-Davao_City_Davao_del_Sur_Province_Mindanao.html,restaurant,,,,,
296,"Tong Yang, SM Davao Ecoland",Davao City,4.0,"February 7, 2020",Tong Yang Experience,"They do have a good variety of food. Reasonable price with good service. It was my first time trying tong yang, luckily we arrived a little bit early that why we were able to secure a seat . I highly recommend to arrive  earlier from...the usual meal time voz there will be a lot of people queuing .",Date of visit:,/ShowUserReviews-g298459-d12812599-r743474349-Tong_Yang_SM_Davao_Ecoland-Davao_City_Davao_del_Sur_Province_Mindanao.html,restaurant,,,,,
297,"Tong Yang, SM Davao Ecoland",Davao City,5.0,"January 20, 2020",Everything you want is at Tong-Yang,"Cook all you want, eat what you cook, satisfy your mouth, fill your stomach and go home with a happy, healthy heart.",Date of visit:,/ShowUserReviews-g298459-d12812599-r740191721-Tong_Yang_SM_Davao_Ecoland-Davao_City_Davao_del_Sur_Province_Mindanao.html,restaurant,,,,,
298,"Tong Yang, SM Davao Ecoland",Davao City,5.0,"November 20, 2019",Dinner time,"been here how many times. food was awesome! a lot of choices. you can have soup , grill or cooked dishes.  special thanks to maam REX and Bryan for assisting us.",Date of visit:,/ShowUserReviews-g298459-d12812599-r727673964-Tong_Yang_SM_Davao_Ecoland-Davao_City_Davao_del_Sur_Province_Mindanao.html,restaurant,,,,,
299,"Tong Yang, SM Davao Ecoland",Davao City,5.0,"July 13, 2019",Lunch at Tongyang,"Thanks to Sir Robert, very accommodating and nice. Ang sarap nung seafood soup na ginawa nya for us. 

Definitely, we'll be back with other friends and family and the EQUINOX Land Surveying Team. 

We love it. Salamat again.",Date of visit:,/ShowUserReviews-g298459-d12812599-r689148326-Tong_Yang_SM_Davao_Ecoland-Davao_City_Davao_del_Sur_Province_Mindanao.html,restaurant,,,,,
300,Cafe Tavera,Davao City,5.0,"July 30, 2023",Great seafood,"I ate all the grilled tuna belly, but we had crabs, shrimp, tuna jaw, and of course rice. It was wonderful. The service was excellent and we had a very nice meal with friends. I highly recommend this place for dinner with friends.",Date of visit:,/ShowUserReviews-g298459-d5793039-r906553473-Cafe_Tavera-Davao_City_Davao_del_Sur_Province_Mindanao.html,restaurant,,,,,
301,Cafe Tavera,Davao City,5.0,"July 30, 2020",Thanks Chef ,"Great ambiance! Excellent salted egg crab, Kinilaw na malasugue, and grilled tiger prawns. Clean restaurant!! I’m definitely coming back for more!! If you happen to be in Davao city, it’s the place to a meal.",Date of visit:,/ShowUserReviews-g298459-d5793039-r762227213-Cafe_Tavera-Davao_City_Davao_del_Sur_Province_Mindanao.html,restaurant,,,,,
302,Cafe Tavera,Davao City,5.0,"March 7, 2020",Great Seafood Restaurant,Anither excellent seafood meal at this excellent seafood restaurant.   Food and service cannot be faulted.    I will go back and I recommend you to visit.   You will not be disappointed.,Date of visit:,/ShowUserReviews-g298459-d5793039-r749630570-Cafe_Tavera-Davao_City_Davao_del_Sur_Province_Mindanao.html,restaurant,,,,,
303,Cafe Tavera,Davao City,5.0,"February 24, 2020",Valentines day,"Its a fine and romantic night.witch we celebrate as a couple..and yet it a good choice of good food and the price is jst right.clean restroom,accumodating staff.",Date of visit:,/ShowUserReviews-g298459-d5793039-r747269866-Cafe_Tavera-Davao_City_Davao_del_Sur_Province_Mindanao.html,restaurant,,,,,
304,Cafe Tavera,Davao City,5.0,"February 23, 2020",Nice place and good food..super masarap talaga dito,"Dito po ninyu makikita ang masasarap na seafood specialty..as in masarap talaga..dragaon ball,crabs with salted egg,lapu2 steamed garlic..",Date of visit:,/ShowUserReviews-g298459-d5793039-r746979470-Cafe_Tavera-Davao_City_Davao_del_Sur_Province_Mindanao.html,restaurant,,,,,
305,Cafe Tavera,Davao City,5.0,"February 22, 2020",Good food ever...,"We had great experience ever sa lahat na restaurant na nka inan with my family,the place is clean have good accommodation especially the waiters well accommodating, the foods so fabulous.... especially there shakes and desserts...we will back here to my soon...",Date of visit:,/ShowUserReviews-g298459-d5793039-r746645542-Cafe_Tavera-Davao_City_Davao_del_Sur_Province_Mindanao.html,restaurant,,,,,
306,Cafe Tavera,Davao City,5.0,"February 22, 2020",Great food,Very nice food and good service.i  Love this place so much..I'm very satisfied this restaurant in Davao City Philippines ...more choices of food and very fresh sea foods display. And all my friends are mostly this and my family and even my workmates ... Most...of the time that we have parties  we were here. Thanks cafe tavera....,Date of visit:,/ShowUserReviews-g298459-d5793039-r746645156-Cafe_Tavera-Davao_City_Davao_del_Sur_Province_Mindanao.html,restaurant,,,,,
307,Cafe Tavera,Davao City,5.0,"February 22, 2020",very Satifying Dining Experience,"Satisfied guest here.😍 I love the place I love the Food very accomodating staffs. great seafoods, highly recommended restaurant. They also have funtion rooms at very affordable price rate. must try here.",Date of visit:,/ShowUserReviews-g298459-d5793039-r746643011-Cafe_Tavera-Davao_City_Davao_del_Sur_Province_Mindanao.html,restaurant,,,,,
308,Cafe Tavera,Davao City,5.0,"November 28, 2019",yummy dishes,"visited Davao twice and dined here twice in a month. theres a good variety of dishes to choose from and a variety of fresh seafoods too. the homey ambience and good service from the staff is a plus. my personal favorites are steamed pompano, dragon...balls, crab fooyong and sigarilyas with oyster sauce.",Date of visit:,/ShowUserReviews-g298459-d5793039-r729331119-Cafe_Tavera-Davao_City_Davao_del_Sur_Province_Mindanao.html,restaurant,,,,,
309,Cafe Tavera,Davao City,4.0,"November 26, 2019",Fresh seafood ,"We had a huge lunch here and the crap was definitely the best dish we had!
I did also like the seaweed salad and the pork ribs!
One thing that would of been better is to serve each dish as it is ready and hot......most dishes arrived to the table cold. 
The steamed fish was good but we thought it was over cooked. I would go back but maybe not for lunch but dinner. I would tell them to bring the food out of the kitchen as each dish was ready so that we would be eating hot food!",Date of visit:,/ShowUserReviews-g298459-d5793039-r728952847-Cafe_Tavera-Davao_City_Davao_del_Sur_Province_Mindanao.html,restaurant,,,,,
310,Cafe Tavera,Davao City,5.0,"November 4, 2019",Yummers!,"A homey feel,a great dining experience! All the food we ordered were sumptuous and serving was generous. The waiters were prompt and quick on their feet. It was My daughter's first time to taste the tuna belly and she hogged it! Had a great time...here,truly a wonderful dining experience!",Date of visit:,/ShowUserReviews-g298459-d5793039-r723728349-Cafe_Tavera-Davao_City_Davao_del_Sur_Province_Mindanao.html,restaurant,,,,,
311,Cafe Tavera,Davao City,5.0,"October 5, 2019",The BEST SEAFOOD RESTAURANT IN DAVAO,"Great ambiance, they Have Function rooms, Good Food very accomodating and lovely staffs. fresh and great Seafoods👍🏻👍🏻👍🏻",Date of visit:,/ShowUserReviews-g298459-d5793039-r715518220-Cafe_Tavera-Davao_City_Davao_del_Sur_Province_Mindanao.html,restaurant,,,,,
312,Cafe Tavera,Davao City,5.0,"September 22, 2019",My Favorite Resto!,"After 5 years of constant dining at Cafe Tavera, I still consider this restaurant one of Davao's best in terms of great food, friendly service and feel-good ambiance! My additional favorites are their grilled tuna and ginataang langka.  This is one of the places I...go whenever i want to experience pleasurable dining with friends and family!",Date of visit:,/ShowUserReviews-g298459-d5793039-r711820746-Cafe_Tavera-Davao_City_Davao_del_Sur_Province_Mindanao.html,restaurant,,,,,
313,Cafe Tavera,Davao City,3.0,"August 30, 2019",Dinner with friends,The place is small and food is average. They have several rooms for private function. Parking is spacious. Average Filipino food with medium servings. Not that superb taste. Service is great.,Date of visit:,/ShowUserReviews-g298459-d5793039-r704431171-Cafe_Tavera-Davao_City_Davao_del_Sur_Province_Mindanao.html,restaurant,,,,,
314,Cafe Tavera,Davao City,2.0,"August 13, 2019",Lunch.,The place is awesome and the ambience is very relaxing. But the food didn’t taste good. It was bland.,Date of visit:,/ShowUserReviews-g298459-d5793039-r698418462-Cafe_Tavera-Davao_City_Davao_del_Sur_Province_Mindanao.html,restaurant,,,,,
315,Cafe Marco Davao,Davao City,4.0,"June 15, 2020",buffet galore!!!,"the best buffet in town!don't miss it while in davao  city.do come early in order to have the best seat(s).the staff are friendly,they are always with a smile ;-)",Date of visit:,/ShowUserReviews-g298459-d2012283-r757461614-Cafe_Marco_Davao-Davao_City_Davao_del_Sur_Province_Mindanao.html,restaurant,,,,,
316,Cafe Marco Davao,Davao City,5.0,"February 28, 2020",Best buffet in davao I have tasted so far,"The are less number of foods to choose from compared to a well known buffet here in davao... But cafe marco stands out in terms of taste. They may have less number of served foods/viands/etc... But all got superb taste. I like it here sinces...it is not as crowded as the known buffet here in the city. Service is also great! Parking is not a problem. There are a lot of salads that you can choose from. You can also create your own salad, etc.. but if you are hesitant since you are not sure on how to DIY salad... There are salads served that you can choose from.

It is a bit pricey though, but it is like you own the place since there are less people... Oh, forgot to mention that their roast beef is really tender and tastes good... Unlike the competitor's roast beef which seems to have some kind of an armor... LOLs

Did not took any pictures since both of us are really hungry :)

Will comeback again surely :)",Date of visit:,/ShowUserReviews-g298459-d2012283-r748099037-Cafe_Marco_Davao-Davao_City_Davao_del_Sur_Province_Mindanao.html,restaurant,,,,,
317,Cafe Marco Davao,Davao City,5.0,"January 27, 2020",enjoy cafe marco,Its right at the heart of Davao City. Enjoy good food and view of the City. Its a great dining place to be with.,Date of visit:,/ShowUserReviews-g298459-d2012283-r741588307-Cafe_Marco_Davao-Davao_City_Davao_del_Sur_Province_Mindanao.html,restaurant,,,,,
318,Cafe Marco Davao,Davao City,4.0,"December 25, 2019",Wide choices,Food were great. There's a wide array of selection of food from different cuisine.F&B service was excellent.,Date of visit:,/ShowUserReviews-g298459-d2012283-r734552410-Cafe_Marco_Davao-Davao_City_Davao_del_Sur_Province_Mindanao.html,restaurant,,,,,
319,Cafe Marco Davao,Davao City,5.0,"October 10, 2019",Breakfast Buffet,"I always start my birthday with a breakfast buffet in the best hotel in town. In Manila, I used to go to the Manila Mandarin until it closed! Now loving in Davao City, I continue this tradition at the Cafe Marco Davao in Marco Polo...Davao. I am not disappointed. It has a good selection of appetizers with cold cuts I enjoy like Jamon Serrano, real dry salami, smoked salmon, among others. I like that they carry Malagos cheese in their cheese section. They cater to Chinese clients too so there is the congee with all the condiments, steamed siomai and siopao, and for Japanese clients, the different sushis. Filipinos can get their fill of Lomi. The fruits and nuts are varied both natively grown in Davao or imported from Manila or abroad. The salad bar is scrumptious, the breads, croissants, and pastries plentiful and the cereals are varied. After just these, I usually do not have room for the main course of various breakfast meats and sausages,garlic fried or steamed or chinese fried rice, go very well with these. And if you have room, they do have cakes and pastries for dessert! But even more than the food, I like the service of the friendly and smiling staff, ready to give you more coffee, tea, or hot chocolate and water. The overall ambiance is also elegant, making you feel special.",Date of visit:,/ShowUserReviews-g298459-d2012283-r716984922-Cafe_Marco_Davao-Davao_City_Davao_del_Sur_Province_Mindanao.html,restaurant,,,,,
320,Cafe Marco Davao,Davao City,4.0,"August 13, 2019",quality and service,"Buffet style - located on the 2nd floor of the Marco Polo. We stayed 14 days and used the restaurant for breakfast everyday. A very wide range of food from traditional European to Filipino, I could not fault this place, Staff, as always were excellent...and very attentive",Date of visit:,/ShowUserReviews-g298459-d2012283-r698338870-Cafe_Marco_Davao-Davao_City_Davao_del_Sur_Province_Mindanao.html,restaurant,,,,,
321,Cafe Marco Davao,Davao City,4.0,"July 25, 2019",One of the Few Decent Buffets in Davao City,"Located at the 2nd floor of Marco Polo, Cafe Marco offers breakfast, lunch and dinner buffet. The selection is quite limited to only a few main course but it is delicious and worth the price. Their pastries and cakes are top notch, along with the...ice cream bar. Definitely a must-try.",Date of visit:,/ShowUserReviews-g298459-d2012283-r692493084-Cafe_Marco_Davao-Davao_City_Davao_del_Sur_Province_Mindanao.html,restaurant,,,,,
